ホテルグランテラス帯広,https://www.yukoyuko.net/0001,〒080-0011,北海道帯広市西１条南１１−２
岡田旅館・和楽亭,https://www.yukoyuko.net/0004,〒506-1433,岐阜県高山市奥飛騨温泉郷平湯温泉505
運河の宿　おたる　ふる川,https://www.yukoyuko.net/0013,〒047-0031,北海道小樽市色内1-2-15
ホテル　パティオ・ドウゴ,https://www.yukoyuko.net/0019,〒790-0842,愛媛県松山市道後湯之町２０−１２
ホテル　バーデン,https://www.yukoyuko.net/0020,〒963-0112,福島県郡山市安積町成田島ノ前2-3
ホテル国富アネックス,https://www.yukoyuko.net/0026,〒941-0071,新潟県糸魚川市大野298-1
北見ピアソンホテル,https://www.yukoyuko.net/0027,〒090-0043,北海道北見市北３条西３丁目６
シャトレーゼホテル石和,https://www.yukoyuko.net/0030,〒406-0021,山梨県笛吹市石和町松本348-1
尾瀬戸倉温泉湯元ホテル玉城屋,https://www.yukoyuko.net/0033,〒,群馬県利根郡片品村戸倉604
伊香保温泉　ホテル木暮,https://www.yukoyuko.net/0034,〒377-0102,群馬県渋川市伊香保町伊香保135
船小屋温泉　ホテル樋口軒,https://www.yukoyuko.net/0036,〒833-0014,福岡県福岡県筑後市尾島805-1
阿寺温泉　フォレスパ木曽あてら荘,https://www.yukoyuko.net/0041,〒399-5504,長野県木曽郡大桑村野尻939-58
パシフィック温泉ホテル　清龍園,https://www.yukoyuko.net/0046,〒049-2566,北海道北海道二海郡八雲町上の湯162-1
俄虫温泉旅館,https://www.yukoyuko.net/0047,〒043-1104,北海道桧山郡厚沢部町上里92
マ・メゾン西湖店,https://www.yukoyuko.net/0051,〒401-0032,山梨県南都留郡富士河口湖町西湖２３３０
鹿児島　砂むし温泉　指宿白水館,https://www.yukoyuko.net/0052,〒891-0404,鹿児島県指宿市東方12126-12
宿毛リゾート椰子の湯,https://www.yukoyuko.net/0053,〒788-0014,高知県宿毛市大島17-27
歴史の宿　金具屋,https://www.yukoyuko.net/0055,〒381-0401,長野県長野県下高井郡山ノ内町平穏2202
老神温泉　伍楼閣,https://www.yukoyuko.net/0056,〒378-0322,群馬県沼田市利根町老神602
青根温泉　一棟温泉宿,https://www.yukoyuko.net/0078,〒989-0908,宮城県柴田郡川崎町青根温泉2-1
フォンタナの丘かもう,https://www.yukoyuko.net/0079,〒899-5307,鹿児島県姶良市蒲生町久末434-1
食いしん坊の湯宿・望洋,https://www.yukoyuko.net/0082,〒517-0032,三重県鳥羽市相差町1525
優鶴,https://www.yukoyuko.net/0083,〒414-0054,静岡県伊東市鎌田1075-63
ゆ〜とりあ越中,https://www.yukoyuko.net/0087,〒939-2224,富山県富山市春日96-1
SHIRAHAMA　KEY　TERRACE　SEAMORE RESIDENCE　シーモアレジデンス,https://www.yukoyuko.net/0088,〒649-2211,和歌山県西牟婁郡白浜町１７７９−１０
吉池旅館,https://www.yukoyuko.net/0091,〒250-0311,神奈川県足柄下郡箱根町湯本597
鞆の浦温泉ホテル鴎風亭,https://www.yukoyuko.net/0092,〒,広島県広島県福山市鞆町鞆136
金太郎温泉,https://www.yukoyuko.net/0093,〒937-0013,富山県魚津市天神野新6000
日田天領水の宿,https://www.yukoyuko.net/0095,〒877-0074,大分県日田市中ノ島町685-6
ホテルタマノ,https://www.yukoyuko.net/0096,〒324-0038,栃木県大田原市野崎２−２０−１
イマジン ホテル＆リゾート函館,https://www.yukoyuko.net/0102,〒042-0932,北海道函館市湯川町３−１−１７イマジンホテル＆リゾート函館
登別万世閣,https://www.yukoyuko.net/0109,〒059-0551,北海道登別市登別温泉町２１番地登別万世閣
定山渓万世閣ホテルミリオーネ,https://www.yukoyuko.net/0110,〒061-2302,北海道札幌市南区定山渓温泉東３丁目定山渓万世閣ホテルミリオーネ
洞爺湖万世閣ホテルレイクサイドテラス,https://www.yukoyuko.net/0112,〒049-5721,北海道虻田郡洞爺湖温泉町２１番地洞爺湖万世閣
ホテルモントレエーデルホフ札幌,https://www.yukoyuko.net/0116,〒060-0002,北海道札幌市中央区北２条西１丁目１
笹井ホテル,https://www.yukoyuko.net/0120,〒080-0262,北海道河東郡音更町十勝川温泉北１５丁目１番地
札幌北広島クラッセホテル,https://www.yukoyuko.net/0122,〒061-1101,北海道北広島市中の沢３１６−１
グリーンピア大沼,https://www.yukoyuko.net/0124,〒049-2142,北海道茅部郡森町赤井川２２９
ホテルナトゥールヴァルト富良野,https://www.yukoyuko.net/0127,〒076-0034,北海道富良野市北の峰町１４−４６
ホテル大雪 ONSEN & CANYON RESORT,https://www.yukoyuko.net/0128,〒078-1701,北海道上川郡上川町層雲峡
お宿　欣喜湯,https://www.yukoyuko.net/0130,〒088-3465,北海道川上郡弟子屈町川湯温泉一丁目５−１０
層雲峡温泉　層雲峡観光ホテル,https://www.yukoyuko.net/0132,〒078-1701,北海道上川郡上川町層雲峡
森のゆホテル花神楽,https://www.yukoyuko.net/0133,〒071-1555,北海道上川郡東神楽町２５号
ホテル甘露の森,https://www.yukoyuko.net/0134,〒048-1511,北海道虻田郡ニセコ町ニセコ４１５番地
青の洞窟温泉 ピパの湯　ゆ〜りん館,https://www.yukoyuko.net/0135,〒072-0808,北海道美唄市東明町３区
ＫＩＫＩ知床　ナチュラルリゾート,https://www.yukoyuko.net/0136,〒099-4351,北海道斜里郡斜里町ウトロ香川１９２番地
山中温泉　湯畑の宿　花つばき,https://www.yukoyuko.net/0139,〒922-0138,石川県加賀市山中温泉栢野町ハ３６番地
津南駅前温泉　花とほたる　湯のさと　雪国,https://www.yukoyuko.net/0140,〒949-8206,新潟県中魚沼郡津南町外丸丁2274
グランドパーク小樽,https://www.yukoyuko.net/0141,〒047-0008,北海道小樽市築港１１−３
然別湖畔温泉ホテル風水,https://www.yukoyuko.net/0143,〒081-0344,北海道河東郡鹿追町然別湖畔
ラビスタ函館ベイ（共立リゾート）,https://www.yukoyuko.net/0145,〒040-0065,北海道函館市豊川町１２−６
ラビスタ大雪山（共立リゾート）,https://www.yukoyuko.net/0146,〒071-1472,北海道上川郡東川町旭岳温泉
ユンニの湯,https://www.yukoyuko.net/0150,〒069-1218,北海道夕張郡由仁町伏見１２２番地
ニューオータニイン札幌,https://www.yukoyuko.net/0151,〒060-0002,北海道札幌市中央区北２条西１丁目１番地
定山渓ビューホテル,https://www.yukoyuko.net/0154,〒061-2302,北海道札幌市南区定山渓温泉東２−１１１−２
札幌東急ＲＥＩホテル,https://www.yukoyuko.net/0156,〒064-8509,北海道札幌市中央区南４条西５丁目１番地
札幌エクセルホテル東急,https://www.yukoyuko.net/0157,〒064-0808,北海道札幌市中央区南８条西５丁目４２０番地
ｼｬﾄﾚｰｾﾞ ｶﾞﾄｰｷﾝｸﾞﾀﾞﾑ ｻｯﾎﾟﾛ　ﾎﾃﾙ&ｽﾊﾟﾘｿﾞｰﾄ,https://www.yukoyuko.net/0161,〒002-8043,北海道札幌市北区東茨戸１３２番地
章月グランドホテル,https://www.yukoyuko.net/0162,〒061-2302,北海道札幌市南区定山渓温泉東３丁目２３９番地
ホテルグランテラス千歳,https://www.yukoyuko.net/0164,〒066-8520,北海道千歳市本町4ー4
札幌パークホテル,https://www.yukoyuko.net/0166,〒064-8589,北海道札幌市中央区南１０西３丁目１−１
ホテル函館ロイヤル シーサイド,https://www.yukoyuko.net/0169,〒040-0034,北海道函館市　大森町１６−９
ホテル鹿の湯,https://www.yukoyuko.net/0170,〒061-2303,北海道札幌市南区定山渓温泉西３丁目３２番地
ホテルノルド小樽,https://www.yukoyuko.net/0171,〒047-0031,北海道小樽市色内１丁目４番１６号
ホテルゆもと登別,https://www.yukoyuko.net/0172,〒059-0551,北海道登別市登別温泉町２９番地
プレミアホテル−ＣＡＢＩＮ−札幌,https://www.yukoyuko.net/0175,〒064-0805,北海道札幌市中央区南５条西７丁目５−２プレミアホテル−ＣＡＢＩＮ−札幌
プレミアホテル−ＣＡＢＩＮ−旭川,https://www.yukoyuko.net/0176,〒070-0031,北海道旭川市１条通７丁目
プレミアホテル−ＣＡＢＩＮ−帯広,https://www.yukoyuko.net/0177,〒080-0011,北海道帯広市西１条南１１丁目
札幌グランドホテル,https://www.yukoyuko.net/0178,〒060-0001,北海道札幌市中央区北１条西４丁目
しほろ温泉プラザ緑風,https://www.yukoyuko.net/0180,〒080-1282,北海道河東郡士幌町字下居辺西２線１３４番地しほろ温泉プラザ緑風
幕別温泉パ−クホテル悠湯館,https://www.yukoyuko.net/0181,〒089-0571,北海道中川郡幕別町依田１２６番地幕別温泉パ−クホテル悠湯館
ニセコノーザンリゾート・アンヌプリ,https://www.yukoyuko.net/0182,〒048-1511,北海道虻田郡ニセコ町ニセコ４８０−１
函館元町ホテル,https://www.yukoyuko.net/0183,〒040-0052,北海道函館市大町４番６号
ホテル大平原,https://www.yukoyuko.net/0184,〒080-0263,北海道河東郡音更町十勝川温泉南１５−１
ワン・ニセコ・リゾート・タワーズ,https://www.yukoyuko.net/0185,〒048-1511,北海道虻田郡ニセコ町字ニセコ４５５番地３ワン・ニセコ・リゾート・タワーズ
花もみじ,https://www.yukoyuko.net/0186,〒061-2303,北海道札幌市南区定山渓温泉西３−３２
新富良野プリンスホテル,https://www.yukoyuko.net/0188,〒076-8511,北海道富良野市中御料なし
函館大沼プリンスホテル,https://www.yukoyuko.net/0189,〒041-1392,北海道亀田郡七飯町西大沼温泉函館大沼プリンスホテル
札幌プリンスホテル,https://www.yukoyuko.net/0190,〒060-8615,北海道札幌市中央区南２条西１１丁目
ゆとりろ洞爺湖,https://www.yukoyuko.net/0192,〒049-5721,北海道虻田郡洞爺湖町洞爺湖温泉７８
森のスパリゾート　北海道ホテル,https://www.yukoyuko.net/0193,〒080-0017,北海道帯広市西七条南１９−１
湯の川観光ホテル祥苑【伊東園ホテルズ】,https://www.yukoyuko.net/0194,〒042-0932,北海道函館市湯川町２−４−２０
釧路プリンスホテル,https://www.yukoyuko.net/0195,〒085-8581,北海道釧路市幸町７丁目１番地
屈斜路プリンスホテル,https://www.yukoyuko.net/0196,〒088-3395,北海道川上郡弟子屈町屈斜路温泉
ホテル武蔵亭,https://www.yukoyuko.net/0197,〒047-0154,北海道小樽市朝里川温泉２丁目６８６
津軽のお宿　南田温泉 ホテルアップルランド,https://www.yukoyuko.net/0207,〒036-0114,青森県平川市町居南田１６６−３
とわだこ遊月,https://www.yukoyuko.net/0209,〒018-5511,秋田県鹿角郡小坂町十和田湖休平３６
奥津軽の名湯 稲垣温泉ホテル花月亭本館,https://www.yukoyuko.net/0210,〒037-0104,青森県つがる市稲垣町大字豊川字宮川３−４
北前の宿 深浦観光ホテル,https://www.yukoyuko.net/0211,〒038-2324,青森県西津軽郡深浦町深浦岡崎３３８−４２
ロックウッド・ホテル＆スパ,https://www.yukoyuko.net/0217,〒038-2793,青森県西津軽郡鯵ヶ沢町鰺ヶ沢高原
津軽藩本陣の宿　旅館　柳の湯,https://www.yukoyuko.net/0218,〒039-3501,青森県青森市浅虫字山下２３６
とわだこ賑山亭,https://www.yukoyuko.net/0220,〒018-5511,秋田県鹿角郡小坂町十和田湖休平３５
南部屋・海扇閣,https://www.yukoyuko.net/0224,〒039-3501,青森県青森市浅虫蛍谷３１
ホテル十和田荘,https://www.yukoyuko.net/0225,〒018-5501,青森県十和田市十和田湖畔　休屋　３４０
奥入瀬　森のホテル,https://www.yukoyuko.net/0228,〒034-0303,青森県十和田市法量字焼山３６−２０
星の宿白鳥座,https://www.yukoyuko.net/0233,〒036-1505,青森県弘前市大字水木在家字桜井１１３−２
天然温泉掛け流しの宿　ホテルポニー温泉,https://www.yukoyuko.net/0235,〒034-0001,青森県十和田市三本木字佐井幅１６７−１
花禅の庄,https://www.yukoyuko.net/0238,〒036-0412,青森県黒石市袋字富山64-2
ホテルＪＡＬシティ青森,https://www.yukoyuko.net/0240,〒030-0803,青森県青森市安方二丁目４番１２号
ホテルグランメール山海荘,https://www.yukoyuko.net/0242,〒038-2761,青森県西津軽郡鰺ヶ沢町大字舞戸町字鳴戸１番地
三沢シティホテル,https://www.yukoyuko.net/0243,〒033-0001,青森県三沢市中央町２丁目１−１
下風呂観光ホテル 漁火の宿 三浦屋,https://www.yukoyuko.net/0246,〒039-4501,青森県下北郡風間浦村下風呂７０
亀の井ホテル 青森まかど（旧：まかど観光ホテル）,https://www.yukoyuko.net/0247,〒039-3175,青森県上北郡野辺地町湯沢９
鯵ケ沢温泉　水軍の宿,https://www.yukoyuko.net/0248,〒038-2761,青森県西津軽郡鯵ケ沢町大字舞戸町字下富田２６−１
弘前パークホテル,https://www.yukoyuko.net/0250,〒036-8182,青森県弘前市土手町１２６
かねさだ旅館,https://www.yukoyuko.net/0256,〒036-0412,青森県黒石市大字袋字富田66-5
秋山郷 雄川閣,https://www.yukoyuko.net/0261,〒949-8321,長野県下水内郡栄村堺１７８７８−３
白骨温泉　湯元齋藤旅館,https://www.yukoyuko.net/0262,〒390-1515,長野県松本市安曇白骨温泉4195
白骨温泉 湯元齋藤旅館別館,https://www.yukoyuko.net/0263,〒390-1515,長野県松本市安曇白骨温泉4200
西伊豆　今宵,https://www.yukoyuko.net/0264,〒410-3402,静岡県沼津市戸田3878-86
Relax Resort Hotel,https://www.yukoyuko.net/0270,〒413-0019,静岡県熱海市咲見町6-41
TSUKI 東京,https://www.yukoyuko.net/0271,〒104-0045,東京都中央区築地1-9-4
信州不動温泉　さぎり荘,https://www.yukoyuko.net/0272,〒,長野県上水内郡信州新町日原西300-1
磐梯熱海温泉　離れの宿　よもぎ埜,https://www.yukoyuko.net/0274,〒,福島県郡山市熱海町熱海5-33
ホテルウィングインターナショナル札幌すすきの,https://www.yukoyuko.net/0276,〒064-0806,北海道札幌市中央区南6条西6丁目2-2
くつろぎの邸　くにたち,https://www.yukoyuko.net/0278,〒406-0024,山梨県笛吹市石和町川中島４１０
スーパーホテル三原駅前,https://www.yukoyuko.net/0279,〒723-0014,広島県三原市城町1丁目12番10号
山代温泉　瑠璃光,https://www.yukoyuko.net/0280,〒922-0295,石川県加賀市山代温泉19-58-1
東北温泉,https://www.yukoyuko.net/0286,〒039-2661,青森県上北郡東北町上笹橋21-18
むつグランドホテル,https://www.yukoyuko.net/0288,〒035-0021,青森県むつ市田名部下道4
創作料理の宿　十和田湖レークサイドホテル,https://www.yukoyuko.net/0292,〒018-5501,青森県十和田市奥瀬十和田湖畔休屋486
HOTEL Jogakura (ホテル城ヶ倉),https://www.yukoyuko.net/0293,〒030-0111,青森県青森市荒川八甲田山中
山代温泉　葉渡莉,https://www.yukoyuko.net/0297,〒922-0254,石川県加賀市山代温泉温泉通り17
ホテルキャッスル　山形,https://www.yukoyuko.net/0298,〒990-0031,山形県山形市十日町四丁目２−７
新安比温泉　静流閣,https://www.yukoyuko.net/0304,〒028-7533,岩手県八幡平市叺田４３−１
盛岡つなぎ温泉 愛真館,https://www.yukoyuko.net/0305,〒020-0055,岩手県盛岡市繋字塗沢４０−４
盛岡つなぎ温泉 ホテル紫苑,https://www.yukoyuko.net/0310,〒020-0055,岩手県盛岡市繋字湯の舘７４−２
游泉　志だて,https://www.yukoyuko.net/0313,〒025-0244,岩手県花巻市湯口志戸平１１−２
ホテル偕楽苑,https://www.yukoyuko.net/0314,〒020-0574,岩手県岩手郡雫石町鶯宿第１０地割３−１
渡り温泉　ホテルさつき,https://www.yukoyuko.net/0315,〒025-0244,岩手県花巻市湯口字佐野２１−８
湯の杜　ホテル志戸平,https://www.yukoyuko.net/0316,〒025-0244,岩手県花巻市湯口字志戸平２７−１ホテル志戸平
天然温泉 田沢湖レイクリゾート,https://www.yukoyuko.net/0318,〒014-1201,秋田県仙北市田沢湖生保内字下高野８２−１１７天然温泉 田沢湖レイクリゾート
やまゆりの宿,https://www.yukoyuko.net/0319,〒025-0305,岩手県花巻市台２−５７−９
長栄館,https://www.yukoyuko.net/0321,〒020-0574,岩手県岩手郡雫石町鴬宿６−７
渚亭　たろう庵,https://www.yukoyuko.net/0322,〒027-0322,岩手県宮古市田老字青砂里１６４−１
雫石プリンスホテル,https://www.yukoyuko.net/0323,〒020-0593,岩手県岩手郡雫石町高倉温泉雫石プリンスホテル
ホテル龍泉洞 愛山,https://www.yukoyuko.net/0324,〒027-0501,岩手県下閉伊郡岩泉町岩泉字松橋１−２
浄土ヶ浜パークホテル,https://www.yukoyuko.net/0327,〒027-0001,岩手県宮古市日立浜町３２−４
八幡平マウンテンホテル,https://www.yukoyuko.net/0331,〒028-7302,岩手県八幡平市松尾寄木１地割５０９番地１号
奥州平泉温泉 そば庵　しづか亭,https://www.yukoyuko.net/0333,〒029-4102,岩手県平泉町平泉字長倉１０−５しづか亭
四季彩の宿　ふる里,https://www.yukoyuko.net/0334,〒029-5514,岩手県和賀郡西和賀町湯川５２地割１７四季彩の宿　ふる里
いやしろの湯　ホテル三右ェ門,https://www.yukoyuko.net/0335,〒025-0305,岩手県花巻市台２−４５
瀬美温泉　山吹の花・桐の花,https://www.yukoyuko.net/0339,〒024-0322,岩手県北上市和賀町岩崎新田１−１２８−２
渡り温泉　別邸楓,https://www.yukoyuko.net/0340,〒025-0244,岩手県花巻市湯口字佐野２１−８
大沢温泉　山水閣,https://www.yukoyuko.net/0341,〒025-0244,岩手県花巻市湯口字大沢１８１
花巻南温泉峡　山の神温泉　優香苑,https://www.yukoyuko.net/0345,〒025-0253,岩手県花巻市下シ沢中野５３番地１
山王山温泉　瑞泉郷　旧）矢びつ温泉　瑞泉閣,https://www.yukoyuko.net/0346,〒021-0101,岩手県一関市厳美町字下り松６５−２
雨晴温泉　磯はなび,https://www.yukoyuko.net/0354,〒933-0133,富山県高岡市太田88-1
SPA LODGE Red wood Inn　レッドウッドイン,https://www.yukoyuko.net/0355,〒382-0817,長野県上高井郡高山村大字奥山田3681-347
花巻温泉(ホテル花巻/ホテル紅葉館/ホテル千秋閣),https://www.yukoyuko.net/0357,〒025-0304,岩手県花巻市湯本第１地割１２５番地
岩手山焼走り温泉　いこいの村岩手,https://www.yukoyuko.net/0361,〒028-7113,岩手県八幡平市平笠２４−１−４
ホテルエース盛岡,https://www.yukoyuko.net/0364,〒020-0021,岩手県盛岡市中央通２丁目１１−３５
ホテル加賀助,https://www.yukoyuko.net/0365,〒020-0574,岩手県岩手郡雫石町鶯宿７−４７
佳松園,https://www.yukoyuko.net/0373,〒025-0304,岩手県花巻市湯本１−１２５−２
国際ホテル山口,https://www.yukoyuko.net/0376,〒753-0088,山口県山口市中河原町1-1
海鮮の宿 ごいし荘 別邸 海さんぽ,https://www.yukoyuko.net/0377,〒022-0001,岩手県大船渡市末崎町大豆沢４６−１
いつくし園,https://www.yukoyuko.net/0378,〒021-0101,岩手県一関市厳美町字南滝の上１５
平泉ホテル武蔵坊,https://www.yukoyuko.net/0387,〒029-4102,岩手県西磐井郡平泉町平泉字大沢１５
盛岡つなぎ温泉　四季亭,https://www.yukoyuko.net/0388,〒020-0055,岩手県盛岡市繋字湯の館１３７
鶯宿温泉の宿 赤い風車,https://www.yukoyuko.net/0391,〒020-0574,岩手県岩手郡雫石町鶯宿１０−７５−２
永岡温泉　夢の湯,https://www.yukoyuko.net/0392,〒029-4504,岩手県胆沢郡金ケ崎町永沢石持沢６−２８４
千貫石温泉 湯元 東館,https://www.yukoyuko.net/0394,〒029-4503,岩手県胆沢郡金ヶ崎町西根二枚橋5-1
ANAクラウンプラザリゾート安比高原,https://www.yukoyuko.net/0395,〒278-7396,岩手県八幡平市安比高原ANAｸﾗｳﾝﾌﾟﾗｻﾞﾘｿﾞｰﾄ安比高原
プレミアホテル-CABIN PRESIDENT-大阪,https://www.yukoyuko.net/0400,〒530-0054,大阪府大阪市北区南森町１−３−１９
秋保温泉　ホテル華乃湯,https://www.yukoyuko.net/0401,〒982-0241,宮城県仙台市太白区秋保町湯元字除３３−１
名湯の宿　鳴子ホテル,https://www.yukoyuko.net/0403,〒989-6823,宮城県大崎市鳴子温泉字湯元３６
花ごころの湯　新富亭,https://www.yukoyuko.net/0411,〒981-0213,宮城県宮城郡松島町松島字垣の内３８−１
湯の原ホテル,https://www.yukoyuko.net/0413,〒989-3431,宮城県仙台市青葉区作並字元木１番地
奥州秋保温泉 蘭亭,https://www.yukoyuko.net/0418,〒982-0241,宮城県仙台市太白区秋保町湯元字木戸保７−１
島周の宿 さか井,https://www.yukoyuko.net/0419,〒986-2523,宮城県石巻市鮎川浜万治下１−７
アクティブリゾーツ 宮城蔵王,https://www.yukoyuko.net/0424,〒989-0916,宮城県刈田郡蔵王町遠刈田温泉字鬼石原１−１
ホテル亀屋,https://www.yukoyuko.net/0425,〒989-6821,宮城県大崎市鳴子温泉字車湯５４−６
秋保リゾート ホテルクレセント,https://www.yukoyuko.net/0430,〒982-0241,宮城県仙台市太白区秋保町湯元字行沢１−２
鷹泉閣 岩松旅館,https://www.yukoyuko.net/0439,〒989-3431,宮城県仙台市青葉区作並温泉元湯
ブリーズベイシーサイドリゾート松島,https://www.yukoyuko.net/0441,〒981-0213,宮城県宮城郡松島町松島字犬田１−１０
山景の宿　流辿,https://www.yukoyuko.net/0442,〒989-0908,宮城県柴田郡川崎町青根温泉１７−２
亀の井ホテル 富田林,https://www.yukoyuko.net/0451,〒584-0053,大阪府富田林市龍泉880-1
小松館　好風亭,https://www.yukoyuko.net/0452,〒981-0213,宮城県宮城郡松島町松島字仙随３５−２
ホテル大松荘,https://www.yukoyuko.net/0453,〒981-0213,宮城県宮城郡松島町松島字町内２５
気仙沼プラザホテル,https://www.yukoyuko.net/0458,〒988-0014,宮城県気仙沼市柏崎１番１号
蔵王のお宿　旬樹庵　さんさ亭,https://www.yukoyuko.net/0464,〒989-0916,宮城県刈田郡蔵王町遠刈田温泉東裏３０番地
秋保グランドホテル,https://www.yukoyuko.net/0465,〒982-0241,宮城県仙台市太白区秋保町湯元字枇杷原１２−２
ホテルモントレ仙台,https://www.yukoyuko.net/0466,〒980-0021,宮城県仙台市青葉区中央４丁目１番８号ホテルモントレ仙台
大人の隠れ家　鳴子風雅,https://www.yukoyuko.net/0468,〒989-6823,宮城県大崎市鳴子温泉字湯元５５
白石温泉　薬師の湯,https://www.yukoyuko.net/0471,〒989-0231,宮城県白石市福岡蔵本字薬師堂２８−２白石温泉薬師の湯
ホテルパールシティ仙台,https://www.yukoyuko.net/0472,〒980-0811,宮城県仙台市青葉区一番町二丁目８−９
ホテルグランテラス仙台国分町,https://www.yukoyuko.net/0476,〒980-0803,宮城県仙台市青葉区国分町2-2-2東芝仙台ビル
仙台ヒルズホテル,https://www.yukoyuko.net/0480,〒981-3217,宮城県仙台市泉区実沢中山南２５−５仙台ヒルズホテル
鳴子やすらぎ荘　(センポスの宿),https://www.yukoyuko.net/0481,〒989-6832,宮城県大崎市鳴子温泉字星沼１８−２鳴子船員保険保養所　鳴子やすらぎ荘
仙台サンプラザ,https://www.yukoyuko.net/0483,〒983-0852,宮城県仙台市宮城野区榴岡５丁目１１番１号仙台サンプラザ
鎌先温泉　すゞきや旅館（すずきや）,https://www.yukoyuko.net/0488,〒989-0231,宮城県白石市福岡蔵本字鎌先１−３８
「蔵王の森」がつくる美と健康の温泉宿　ゆと森倶楽部,https://www.yukoyuko.net/0489,〒989-0916,宮城県刈田郡蔵王町遠刈田温泉字上ノ原１２８
サンマリン気仙沼ホテル観洋,https://www.yukoyuko.net/0490,〒988-0021,宮城県気仙沼市港町４−１９番
鳴子温泉郷　勘七湯,https://www.yukoyuko.net/0491,〒989-6811,宮城県大崎市鳴子温泉赤湯１８番地勘七湯
リゾートパーク・ホテルオニコウベ,https://www.yukoyuko.net/0492,〒989-6941,宮城県大崎市鳴子温泉鬼首字大清水26−29
松島温泉　松島一の坊,https://www.yukoyuko.net/0494,〒981-0215,宮城県宮城郡松島町高城字浜１−４
名湯秘湯うなぎ湯の宿　旬樹庵　琢ひで,https://www.yukoyuko.net/0496,〒989-6832,宮城県大崎市鳴子温泉星沼２０−９
Ｌａ楽リゾートホテル　グリーングリーン,https://www.yukoyuko.net/0497,〒989-3431,宮城県仙台市青葉区作並字二橋５−１２
女川温泉　華夕美,https://www.yukoyuko.net/0499,〒986-2231,宮城県牡鹿郡女川町浦宿浜字天王１３０
亀の井ホテル 田沢湖（旧：プラザホテル山麓荘）,https://www.yukoyuko.net/0503,〒014-1201,秋田県仙北市田沢湖生保内字駒ケ岳２−３２プラザホテル山麓荘
男鹿ホテル,https://www.yukoyuko.net/0505,〒010-0687,秋田県男鹿市北浦湯本字草木原１３−１
十和田プリンスホテル,https://www.yukoyuko.net/0516,〒018-5511,秋田県鹿角郡小坂町十和田湖西湖畔西湖畔
