オリエンタルホテル ユニバーサル・シティ,https://www.yukoyuko.net/3648,〒554-0024,大阪府大阪市此花区島屋6丁目2-78
定山渓　ゆらく草庵（共立リゾート）,https://www.yukoyuko.net/3650,〒061-2301,北海道札幌市南区定山渓温泉東3丁目228-1定山渓　ゆらく草庵
Umekoji Potel KYOTO（梅小路ポテル京都）,https://www.yukoyuko.net/3651,〒600-8835,京都府京都市下京区観喜寺町15
熱川温泉ブルーオーシャン,https://www.yukoyuko.net/3652,〒413-0303,静岡県賀茂郡東伊豆町片瀬1139熱川温泉ブルーオーシャン
源泉のお宿　湯河原 千代田荘,https://www.yukoyuko.net/3653,〒259-0314,神奈川県足柄下郡湯河原町宮上637
ロテルド比叡,https://www.yukoyuko.net/3655,〒606-0000,京都府京都市左京区比叡山一本杉
季楽里 龍神,https://www.yukoyuko.net/3656,〒645-0525,和歌山県田辺市龍神村龍神１８９
ホテルウィングインターナショナルプレミアム大阪新世界,https://www.yukoyuko.net/3657,〒556-0002,大阪府大阪市浪速区恵美須東3-6-16
ラ・ジェント・ステイ函館駅前,https://www.yukoyuko.net/3658,〒040-0063,北海道函館市若松町12-8
ザ　グラン　リゾート　プリンセス富士河口湖,https://www.yukoyuko.net/3659,〒401-0302,山梨県南都留郡富士河口湖町小立3919
ザ　グラン　リゾート　エレガンテ軽井沢,https://www.yukoyuko.net/3660,〒389-0104,長野県北佐久郡軽井沢町軽井沢東288番地ザグランリゾート　エレガンテ軽井沢
ザ　グラン　リゾート　エレガンテ熱海,https://www.yukoyuko.net/3661,〒413-0006,静岡県熱海市桃山町12-13
ザ　グラン　リゾート　エレガンテ伊豆,https://www.yukoyuko.net/3662,〒413-0301,静岡県賀茂郡東伊豆町大川145-1ザグランリゾートエレガンテ伊豆
ザ　グラン　リゾート三方五湖,https://www.yukoyuko.net/3663,〒919-1124,福井県美方郡美浜町早瀬3ザグランリゾート三方五湖
ザ　グラン　リゾート　プリンセス有馬,https://www.yukoyuko.net/3664,〒651-1401,兵庫県神戸市北区有馬町1338番地ザ グラン リゾート プリンセス有馬
ザ　グラン　リゾート有馬,https://www.yukoyuko.net/3665,〒651-1401,兵庫県神戸市北区1740-1ザグランリゾート有馬
ザ　グラン　リゾート　エレガンテ淡路島,https://www.yukoyuko.net/3666,〒656-2302,兵庫県淡路市大磯9-3ザ グラン リゾート エレガンテ淡路島
ザ　グラン　リゾート赤穂,https://www.yukoyuko.net/3667,〒678-0221,兵庫県赤穂市尾崎字丸山2298ザグランリゾート赤穂
ヴィラ・コンコルディアリゾート＆スパ,https://www.yukoyuko.net/3668,〒040-0053,北海道函館市末広町3-5
ザ　グラン　リゾート天の橋立,https://www.yukoyuko.net/3669,〒629-2232,京都府宮津市中野203-1ザグランリゾート天の橋立
ザ　グラン　リゾート城崎,https://www.yukoyuko.net/3670,〒669-6123,兵庫県豊岡市小島1188-3ザグランリゾート城崎
ザ　グラン　リゾート　近江舞子,https://www.yukoyuko.net/3671,〒520-0502,滋賀県大津市南小松1454ザグランリゾート近江舞子
ザ グラン リゾート エレガンテ京都,https://www.yukoyuko.net/3672,〒602-8066,京都府京都市上京区中立売通堀川東入る東橋詰町66-3
ザ　グラン　リゾート　エレガンテ白浜,https://www.yukoyuko.net/3673,〒649-2211,和歌山県西牟婁郡白浜町1813-8ザグランリゾートエレガンテ白浜
鈍川温泉 皆楽荘,https://www.yukoyuko.net/3674,〒794-0121,愛媛県今治市玉川町鈍川甲283
観光荘,https://www.yukoyuko.net/3675,〒025-0305,岩手県花巻市台1-166-1観光荘
熱川大和館,https://www.yukoyuko.net/3676,〒413-0302,静岡県賀茂郡東伊豆町奈良本９８６−２
ザ・チェルシーブレス,https://www.yukoyuko.net/3678,〒761-1705,香川県高松市香川町川東下1878THECHELSEABREATH
佐久一萬里温泉ホテル,https://www.yukoyuko.net/3679,〒385-0051,長野県佐久市中込3150-1佐久一萬里温泉ホテル
月岡温泉　ホテル清風苑,https://www.yukoyuko.net/3680,〒959-2397,新潟県新発田市月岡温泉278-2
夫婦露天風呂の宿　天テラス,https://www.yukoyuko.net/3681,〒899-6603,鹿児島県霧島市牧園町高千穂3761
ダイヤモンドあずみ野温泉ホテル,https://www.yukoyuko.net/3682,〒398-8301,長野県安曇野市穂高有明7326-5
檜湯の宿　松伯,https://www.yukoyuko.net/3683,〒399-8301,長野県安曇野市穂高有明7713番地2
男鹿　萬盛閣,https://www.yukoyuko.net/3684,〒010-0687,秋田県秋田県男鹿市北浦湯本字草木原63-2
甘木観光ホテル甘木館,https://www.yukoyuko.net/3685,〒838-0068,福岡県朝倉市甘木2091
箱根小涌園 三河屋旅館,https://www.yukoyuko.net/3686,〒250-0406,神奈川県足柄下郡箱根町小涌谷503
ダイヤモンド八ケ岳美術館ソサエティ,https://www.yukoyuko.net/3687,〒409-1502,山梨県北杜市大泉町谷戸5771-84
三六温泉　神明苑,https://www.yukoyuko.net/3688,〒916-0017,福井県鯖江市神明町２丁目８−４
ほどあいの宿　六峰舘,https://www.yukoyuko.net/3689,〒838-1514,福岡県朝倉市把木久喜宮1840
ラビスタ函館ベイANNEX（共立リゾート）,https://www.yukoyuko.net/3692,〒040-0064,北海道函館市大手町5-23
天然温泉だんだんの湯　御宿 野乃松江,https://www.yukoyuko.net/3693,〒690-0842,島根県松江市東本町2-35天然温泉だんだんの湯　御宿野乃松江
昼神の棲 玄竹,https://www.yukoyuko.net/3694,〒395-0304,長野県下伊那郡阿智村智里331-8
guestroomガーデンあずみ野,https://www.yukoyuko.net/3695,〒399-8301,長野県安曇野市穂高有明7572番地１ガーデンあずみ野
藤岡温泉ホテルリゾート,https://www.yukoyuko.net/3696,〒375-0047,群馬県藤岡市上日野618-2　藤岡温泉ホテルリゾート
くきた別館,https://www.yukoyuko.net/3697,〒869-2503,熊本県阿蘇郡小国町下城3338
京乃宿 清水五条 呉竹荘,https://www.yukoyuko.net/3698,〒605-0878,京都府京都市東山区芳野町７９−２
島崎藤村ゆかりの宿　伊藤屋,https://www.yukoyuko.net/3699,〒259-0314,神奈川県足柄下郡湯河原町宮上488
美肌の湯　きのくにや旅館,https://www.yukoyuko.net/3700,〒250-0523,神奈川県足柄下郡箱根町芦之湯8番地
EN RESORT Grandeco Hotel,https://www.yukoyuko.net/3701,〒969-2701,福島県耶麻郡北塩原村大字桧原字荒砂沢山1082EN RESORT Grandeco Hotel
湯元・小豆島温泉・塩の湯　オーキドホテル,https://www.yukoyuko.net/3703,〒761-4102,香川県小豆郡土庄町甲５１６５−２１６
琴平グランドホテル 桜の抄,https://www.yukoyuko.net/3704,〒766-0001,香川県仲多度郡琴平町９７７−１
ことひら温泉　琴参閣,https://www.yukoyuko.net/3705,〒766-0001,香川県仲多度郡琴平町６８５−１１
庵治観光ホテル　海のやどり,https://www.yukoyuko.net/3710,〒761-0130,香川県高松市庵治町５４９４
こんぴら温泉湯元 八千代,https://www.yukoyuko.net/3711,〒766-0001,香川県仲多度群琴平町６１１
夕凪の湯HOTEL花樹海,https://www.yukoyuko.net/3712,〒760-0004,香川県高松市西宝町３−５−１０
オリビアン小豆島 夕陽ヶ丘ホテル,https://www.yukoyuko.net/3713,〒761-4142,香川県小豆郡土庄町屋形崎甲６３−１
湯元こんぴら温泉華の湯　紅梅亭,https://www.yukoyuko.net/3714,〒766-0001,香川県仲多度郡琴平町５５６−１
つるや旅館,https://www.yukoyuko.net/3715,〒766-0001,香川県仲多度郡琴平町６２０
じゃこ丸パーク津田（国民宿舎　クアパーク津田）,https://www.yukoyuko.net/3723,〒769-2401,香川県さぬき市津田町松原地内番地なし
さぬき温泉,https://www.yukoyuko.net/3726,〒761-1612,香川県高松市塩江町安原上東２０６５−１さぬき温泉
新樺川観光ホテル,https://www.yukoyuko.net/3727,〒761-1612,香川県高松市塩江町安原上東１−６
トレスタ白山,https://www.yukoyuko.net/3728,〒761-0704,香川県木田郡三木町下高岡９７２−３０
ホテルグリーンプラザ小豆島,https://www.yukoyuko.net/3729,〒761-4131,香川県小豆郡土庄町伊喜末２４６４
ベイリゾートホテル小豆島,https://www.yukoyuko.net/3731,〒761-4422,香川県小豆郡小豆島町古江乙１６−３
ハイパーリゾートヴィラ塩江,https://www.yukoyuko.net/3732,〒761-1614,香川県高松市塩江町上西乙６８８−１ハイパーリゾートヴィラ塩江
ホテルアネシス瀬戸大橋,https://www.yukoyuko.net/3733,〒769-0206,香川県綾歌郡宇多津町浜六番丁８１
貸切湯の宿　ことね,https://www.yukoyuko.net/3734,〒766-0001,香川県仲多度郡琴平町６８５−２１
小豆島国際ホテル,https://www.yukoyuko.net/3735,〒761-4106,香川県小豆郡土庄町甲２４−６７
大江戸温泉物語 ホテルレオマの森,https://www.yukoyuko.net/3739,〒761-2405,香川県丸亀市綾歌町栗熊西40-1
いろりの宿 魚虎,https://www.yukoyuko.net/3740,〒761-1612,香川県高松市塩江町安原上東442-2
こんぴら温泉琴平リバーサイドホテル,https://www.yukoyuko.net/3741,〒766-0002,香川県仲多度郡琴平町246-1
JR ホテルクレメント高松,https://www.yukoyuko.net/3746,〒760-0011,香川県高松市浜ノ町１−１
坂出プラザホテル,https://www.yukoyuko.net/3747,〒762-0053,香川県坂出市西大浜北３−２―４３
ザ　レイクビューTOYA乃の風リゾート,https://www.yukoyuko.net/3748,〒049-5721,北海道虻田郡洞爺湖町洞爺湖温泉29-1
緑の風リゾートきたゆざわ,https://www.yukoyuko.net/3749,〒052-0316,北海道伊達市大滝区北湯沢温泉町300-2緑の風リゾートきたゆざわ
きたゆざわ森のソラニワ,https://www.yukoyuko.net/3750,〒052-0316,北海道伊達市大滝区北湯沢温泉町300-7きたゆざわ森のソラニワ
湯元ホロホロ山荘,https://www.yukoyuko.net/3751,〒052-0316,北海道伊達市大滝区北湯沢温泉町37湯元ホロホロ山荘
HAKODATE海峡の風,https://www.yukoyuko.net/3752,〒042-0932,北海道函館市湯川町1丁目18番15号
こぼうしの湯洗心亭,https://www.yukoyuko.net/3753,〒969-5201,福島県南会津郡下郷町大字高陦字寄神乙1614番地
ゆとりろ津和野,https://www.yukoyuko.net/3754,〒699-5605,島根県鹿足郡津和野町後田ロ82-3
草津ホテル 別館 綿の湯,https://www.yukoyuko.net/3755,〒377-1711,群馬県吾妻郡草津町草津469-4
ＨＯＴＥＬ　ＬＥＰＯ　ＣＨＡＨＡＬ,https://www.yukoyuko.net/3756,〒790-0837,愛媛県松山市一番町3-1-1松山三越7・8階
宮之城温泉　手塚ryokan,https://www.yukoyuko.net/3757,〒895-1817,鹿児島県薩摩郡さつま町湯田1482-1
高砂温泉,https://www.yukoyuko.net/3758,〒070-8061,北海道旭川市高砂台8丁目235番地1-5高砂温泉
ホテルリゾーピア熱海,https://www.yukoyuko.net/3759,〒413-0012,静岡県熱海市東海岸町13-93ホテルリゾーピア熱海
八代グランドホテル,https://www.yukoyuko.net/3760,〒866-0844,熊本県八代市旭中央通10-1
ホテルサンデイズ奄美,https://www.yukoyuko.net/3761,〒894-0033,鹿児島県奄美市名瀬矢之脇町30-1
湯宿　羊山邸,https://www.yukoyuko.net/3762,〒368-0023,埼玉県秩父市大宮6278
大人の隠れ癒し宿　秩父長瀞　花湯　別邸,https://www.yukoyuko.net/3763,〒369-1304,埼玉県秩父郡長瀞町本野上47-1
四季彩り 秋田づくし 湯瀬ホテル,https://www.yukoyuko.net/3764,〒018-5141,秋田県鹿角市八幡平湯瀬湯端43番地
SPAWORLD　HOTEL＆RESORT,https://www.yukoyuko.net/3765,〒556-0002,大阪府大阪府大阪市浪速区恵美須東3-4-24SPAWORLD　HOTEL＆RESORT
ヴィラフォンテーヌグランド羽田空港,https://www.yukoyuko.net/3766,〒144-0041,東京都大田区羽田空港2-7-1
ヴィラフォンテーヌグランド東京有明,https://www.yukoyuko.net/3767,〒135-0063,東京都江東区有明2ｰ1-5
江の島ホテル（江の島アイランドスパ ホテル棟）,https://www.yukoyuko.net/3768,〒251-0036,神奈川県藤沢市江の島1-3-8江の島ホテル(江の島アイランドスパ ホテル棟)
ホテル＆リゾート那須霞ヶ城ゴルフクラブ,https://www.yukoyuko.net/3769,〒329-3436,栃木県那須郡那須町伊王野2710
恵那峡温泉ホテル　ゆずり葉,https://www.yukoyuko.net/3770,〒509-7201,岐阜県恵那市大井町2709
ホテル君佳【伊東園ホテルズ】,https://www.yukoyuko.net/3771,〒406-0024,山梨県笛吹市石和町川中島1607-28
HOTEL SANSUI NAHA 琉球温泉 波之上の湯,https://www.yukoyuko.net/3772,〒900-0037,沖縄県沖縄県那覇市辻2-25-1HOTEL SANSUI NAHA琉球温泉 波之上の湯
ペットと泊まる貸別荘　Starry Sky,https://www.yukoyuko.net/3773,〒399-2432,長野県飯田市下瀬254-1
日光ガーデンホテル,https://www.yukoyuko.net/3774,〒329-2921,栃木県那須塩原市塩原1330
琥珀の湯　欅の宿,https://www.yukoyuko.net/3775,〒999-3702,山形県東根市温泉町一丁目8番1号
エスペランサリゾート熱海,https://www.yukoyuko.net/3776,〒413-0003,静岡県熱海市海光町３−１
となみ野庄川荘一萬亭,https://www.yukoyuko.net/3777,〒932-0302,富山県砺波市庄川町庄4984-1となみ野庄川荘一萬亭
ホテルウェルシーズン浜名湖,https://www.yukoyuko.net/3778,〒431-1209,静岡県浜松市中央区舘山寺町1891
マリッサリゾート サザンセト周防大島,https://www.yukoyuko.net/3779,〒742-2512,山口県大島郡周防大島町大字平野１３４７−１
賢島宝生苑,https://www.yukoyuko.net/3780,〒517-0502,三重県志摩市阿児町神明718番地の3賢島宝生苑
阿智の里 ひるがみ,https://www.yukoyuko.net/3781,〒395-0304,長野県下伊那郡阿智村智里503-378
糸島シーサイドリゾート　AlbaHOTEL＆Glamping,https://www.yukoyuko.net/3782,〒819-0165,福岡県福岡市西区今津4787-10
ながぬま温泉,https://www.yukoyuko.net/3783,〒069-1317,北海道夕張郡長沼町東６線北４番地ながぬま温泉
ホテル ブリーズベイ熱海ANNEX,https://www.yukoyuko.net/3784,〒413-0003,静岡県熱海市海光町7-64ホテルブリーズベイ熱海ANNEX
SPA&HOTEL水春松井山手,https://www.yukoyuko.net/3785,〒610-0356,京都府京田辺市山手中央5-1SPA&HOTEL水春 松井山手
ホテルウィングインターナショナル静岡,https://www.yukoyuko.net/3786,〒420-0035,静岡県静岡市葵区七間町11-1
くつろぎの宿　神明山荘,https://www.yukoyuko.net/3787,〒509-2312,岐阜県下呂市御厩野2941-142
HOTEL VISON（ホテルヴィソン）,https://www.yukoyuko.net/3788,〒519-2170,三重県多気郡多気町672-1
フォレストリゾート湯もと小町館,https://www.yukoyuko.net/3789,〒259-0314,神奈川県足柄下郡湯河原町宮上542湯もと小町館
道後舘,https://www.yukoyuko.net/3790,〒790-0841,愛媛県松山市道後多幸町7番地26
KKR蔵王白銀荘,https://www.yukoyuko.net/3791,〒990-2301,山形県山形市蔵王温泉904-8KKR蔵王白銀荘
ホテル久留米ヒルズ,https://www.yukoyuko.net/3792,〒830-0031,福岡県久留米市六ツ門町15-3
御宿　志んぐ荘,https://www.yukoyuko.net/3793,〒679-4313,兵庫県たつの市新宮町新宮1093
オディシススイーツ大阪エアポートホテル,https://www.yukoyuko.net/3794,〒598-0048,大阪府泉佐野市りんくう往来北１番地SISりんくうタワー
ライズホテル大阪北新地,https://www.yukoyuko.net/3795,〒530-0003,大阪府大阪市北区堂島1-1-13
ライズホテル大阪なんば,https://www.yukoyuko.net/3796,〒556-0012,大阪府大阪市浪速区敷津東3-4-21
ホテル オーレ,https://www.yukoyuko.net/3797,〒426-0067,静岡県藤枝市前島1-3-1
有馬 瑞宝園,https://www.yukoyuko.net/3798,〒651-1401,兵庫県神戸市北区有馬町１７５１瑞宝園
鳩山荘松庵,https://www.yukoyuko.net/3799,〒294-0305,千葉県千葉県館山市見物７８７−２
たちばな四季亭,https://www.yukoyuko.net/3800,〒922-0256,石川県加賀市山代温泉万松園通１６
亀の井ホテル 草津湯畑,https://www.yukoyuko.net/3801,〒377-1711,群馬県草津町512-3
源泉かけ流しと眺望露天の湯宿　おもだか,https://www.yukoyuko.net/3802,〒381-0402,長野県下高井郡山ノ内町大字佐野2614-16
ホテル古湧園　遥,https://www.yukoyuko.net/3803,〒790-0836,愛媛県松山市道後鷺谷町１−１
道後プリンスホテル,https://www.yukoyuko.net/3804,〒790-0858,愛媛県松山市道後姫塚１００
奥道後　壱湯の守,https://www.yukoyuko.net/3805,〒791-0122,愛媛県松山市末町２６７
道後グランドホテル,https://www.yukoyuko.net/3806,〒790-0842,愛媛県松山市道後湯之町１６−２１
茶玻瑠,https://www.yukoyuko.net/3807,〒790-0837,愛媛県松山市道後湯月町４−４
道後温泉 ふなや,https://www.yukoyuko.net/3811,〒790-0842,愛媛県松山市道後湯之町１−３３
道後温泉　八千代,https://www.yukoyuko.net/3812,〒790-0841,愛媛県松山市道後多幸町６−３４
ホテル　ルナパーク,https://www.yukoyuko.net/3814,〒790-0836,愛媛県松山市道後鷺谷町５番１９号
湯ノ浦温泉 瀬戸内の水軍浪漫をたどる宿　汐の丸,https://www.yukoyuko.net/3815,〒799-1525,愛媛県今治市湯ノ浦３０番地
ホテル葛城 Spa Resort 道後,https://www.yukoyuko.net/3820,〒790-0837,愛媛県松山市道後湯月町４−１６
花山温泉　温湯山荘,https://www.yukoyuko.net/3825,〒987-2511,宮城県栗原市花山本沢温湯15-1花山温泉　温湯山荘
ハイルザーム栗駒,https://www.yukoyuko.net/3826,〒989-5371,宮城県栗原市栗駒沼倉耕英東50-1ハイルザーム栗駒
熊の湯温泉　熊の湯ホテル,https://www.yukoyuko.net/3827,〒381-0401,長野県下高井郡山ノ内町大字平穏7148
水上温泉あらたし　みなかみ,https://www.yukoyuko.net/3828,〒379-1617,群馬県利根郡みなかみ町湯原740−3あらたしみなかみ
休暇村嬬恋鹿沢,https://www.yukoyuko.net/3829,〒377-1614,群馬県吾妻郡嬬恋村田代1312休暇村嬬恋鹿沢
湯の台温泉　鳥海山荘,https://www.yukoyuko.net/3830,〒999-8207,山形県酒田市草津字湯ノ台66-1
湯河原温泉　夢十夜,https://www.yukoyuko.net/3832,〒259-0314,神奈川県足柄下郡湯河原町宮上535
塩原温泉　八汐荘,https://www.yukoyuko.net/3833,〒329-2921,栃木県那須塩原市塩原2441
ココテラス,https://www.yukoyuko.net/3834,〒413-0231,静岡県伊東市富戸１１３１−８２
ゆの宿 白山菖蒲亭,https://www.yukoyuko.net/3835,〒922-0257,石川県加賀市 山代温泉 桔梗丘4-34-1
伊豆熱川　自家源泉　おもてなしの宿　みはるや,https://www.yukoyuko.net/3836,〒413-0302,静岡県賀茂郡東伊豆町奈良本971-1
奥天竜 不動温泉佐和屋,https://www.yukoyuko.net/3837,〒399-2222,長野県飯田市千代2303-1
紫塚ゴルフ倶楽部　ホテルグリーンヒル,https://www.yukoyuko.net/3838,〒329-1414,栃木県さくら市早乙女2068
石見ワイナリーホテル美郷,https://www.yukoyuko.net/3839,〒696-0706,島根県邑智郡美郷町長藤760-1
ホテルアートシティ,https://www.yukoyuko.net/3840,〒027-0006,岩手県宮古市鍬ヶ崎上町１−５ホテルアートシティ
JURIN,https://www.yukoyuko.net/3841,〒990-2301,山形県山形市蔵王温泉上ノ台814
ラ・フォーレ吹屋,https://www.yukoyuko.net/3842,〒719-2341,岡山県高梁市成羽町吹屋611番地
ホテルクラウンパレス知立,https://www.yukoyuko.net/3843,〒472-0033,愛知県知立市中町中128番地
白浜・温泉リゾート海岳,https://www.yukoyuko.net/3844,〒649-2200,和歌山県西牟婁郡白浜町3212-12海岳
リーガロイヤルホテル新居浜,https://www.yukoyuko.net/3876,〒792-0007,愛媛県新居浜市前田町６−９
カドヤ別荘,https://www.yukoyuko.net/3879,〒794-0121,愛媛県今治市玉川町鈍川甲２８０
オールドイングランド　道後山の手ホテル,https://www.yukoyuko.net/3880,〒790-0836,愛媛県松山市道後鷺谷町１−１３
ホテル椿館,https://www.yukoyuko.net/3881,〒790-0836,愛媛県松山市道後鷺谷町５−３２
ホテルサンルート松山,https://www.yukoyuko.net/3884,〒790-0066,愛媛県松山市宮田町３９１−８ホテルサンルート松山
たかのこのホテル,https://www.yukoyuko.net/3885,〒790-0925,愛媛県松山市鷹子町７３７番地２たかのこのホテル
カンデオホテルズ松山大街道,https://www.yukoyuko.net/3886,〒790-0004,愛媛県松山市大街道２−５−１２
湯の里小町温泉しこくや,https://www.yukoyuko.net/3889,〒799-1107,愛媛県西条市小松町明穂甲４７
道後の宿 花ゆづき,https://www.yukoyuko.net/3890,〒790-0837,愛媛県松山市道後湯月町４−１６
リブマックスリゾート奥道後,https://www.yukoyuko.net/3891,〒791-0122,愛媛県松山市末町３００−１
ウェルピア伊予,https://www.yukoyuko.net/3894,〒799-3105,愛媛県伊予市下三谷１７６１−１
湯快リゾート　道後温泉　道後彩朝楽,https://www.yukoyuko.net/3896,〒790-0858,愛媛県松山市道後姫塚112-1
源泉の宿 かけ流しの湯 いよ西条 湯之谷温泉,https://www.yukoyuko.net/3897,〒793-0053,愛媛県西条市州之内甲1193湯之谷温泉
ホテル松葉川温泉,https://www.yukoyuko.net/3907,〒786-0097,高知県高岡郡四万十町日野地６０５−１
新ロイヤルホテル四万十,https://www.yukoyuko.net/3908,〒787-0029,高知県四万十市中村小姓町２６番地
高知城下の天然温泉　三翠園,https://www.yukoyuko.net/3910,〒780-0862,高知県高知市鷹匠町１丁目３−３５
足摺国際ホテル,https://www.yukoyuko.net/3912,〒787-0315,高知県土佐清水市足摺岬６６２番地
ホテル高砂,https://www.yukoyuko.net/3913,〒780-0053,高知県高知市駅前町２番地１号
土佐の國、真心の宿　城西館,https://www.yukoyuko.net/3914,〒780-0901,高知県高知市上町２丁目５−３４
四万十の宿,https://www.yukoyuko.net/3916,〒787-0155,高知県四万十市下田３３７０四万十いやしの里
ロイヤルホテル 土佐,https://www.yukoyuko.net/3917,〒781-5703,高知県安芸郡芸西村西分甲２９９５
土佐龍温泉　三陽荘,https://www.yukoyuko.net/3921,〒781-1165,高知県土佐市宇佐町竜５０４−１
ホテルベルリーフ大月,https://www.yukoyuko.net/3923,〒788-0313,高知県幡多郡大月町周防形４０４
ホテル　星羅四万十,https://www.yukoyuko.net/3928,〒787-1603,高知県四万十市西土佐用井１１００ホテル星羅四万十
足摺サニーサイドホテル,https://www.yukoyuko.net/3933,〒787-0316,高知県土佐清水市松尾１９−２
ホテル足摺園,https://www.yukoyuko.net/3934,〒787-0315,高知県土佐清水市足摺岬４７８−５ホテル足摺園
リバーサイドホテル松栄,https://www.yukoyuko.net/3936,〒780-8012,高知県高知市天神町８番１号
土佐御苑,https://www.yukoyuko.net/3937,〒780-0052,高知県高知市大川筋１丁目４−８
千年の美湯　そうだ山温泉　和　YAWARAGI,https://www.yukoyuko.net/3943,〒785-0045,高知県須崎市桑田山乙1122
物部川のほとりの温泉宿　夢の温泉,https://www.yukoyuko.net/3944,〒782-0003,高知県香美市土佐山田町宮ノ口364
亀の井ホテル 高知,https://www.yukoyuko.net/3945,〒781-2128,高知県吾川郡いの町波川1569
中村第一ホテル,https://www.yukoyuko.net/3950,〒787-0014,高知県四万十市駅前町５−１５
ブライトパークホテル,https://www.yukoyuko.net/3956,〒780-0842,高知県高知市追手筋１−５−１３
松栄第二別館,https://www.yukoyuko.net/3958,〒780-0864,高知県高知市唐人町3-12
中津渓谷ゆの森,https://www.yukoyuko.net/3959,〒781-1741,高知県吾川郡仁淀川町名野川258-1
桑之屋,https://www.yukoyuko.net/4000,〒839-1405,福岡県うきは市古川１０９９−１０
ロイヤルホテル 宗像,https://www.yukoyuko.net/4005,〒811-3514,福岡県宗像市田野１３０３
ホテルクラウンパレス北九州,https://www.yukoyuko.net/4006,〒806-8585,福岡県北九州市八幡西区東曲里町３−１ホテルクラウンパレス北九州
くつろぎの森　グリーンピア八女,https://www.yukoyuko.net/4010,〒834-1204,福岡県八女市黒木町木屋１０９０５
原鶴グランドスカイホテル,https://www.yukoyuko.net/4013,〒838-1514,福岡県朝倉市杷木久喜宮１８２０−１
くつろぎの宿　泰泉閣,https://www.yukoyuko.net/4015,〒838-1521,福岡県朝倉市杷木志波２０番地
国民宿舎　マリンテラスあしや,https://www.yukoyuko.net/4019,〒807-0141,福岡県遠賀郡芦屋町山鹿１５８８
ザ・ルイガンズ．スパ＆リゾート,https://www.yukoyuko.net/4021,〒811-0321,福岡県福岡市東区西戸崎１８−２５
クラウンヒルズ小倉,https://www.yukoyuko.net/4023,〒802-0081,福岡県北九州市小倉北区紺屋町８−５
