黒船ホテル,https://www.yukoyuko.net/2241,〒415-8514,静岡県下田市柿崎３−８
ホテルラヴィエ川良,https://www.yukoyuko.net/2245,〒414-0027,静岡県伊東市竹の内１−１−３
横山大観ゆかりの宿　大観荘,https://www.yukoyuko.net/2246,〒413-0031,静岡県熱海市林ガ丘町７−１
伊東温泉　山岸園,https://www.yukoyuko.net/2260,〒414-0006,静岡県伊東市松原６５７
下田プリンスホテル,https://www.yukoyuko.net/2261,〒415-0012,静岡県下田市白浜１５４７−１
ダイワロイネットホテル 名古屋伏見,https://www.yukoyuko.net/2269,〒460-0008,愛知県名古屋市中区栄１−５−２１
絶景の宿 ホテル天遊,https://www.yukoyuko.net/2273,〒410-3514,静岡県賀茂郡西伊豆町仁科２９６２
海のほてる　いさば,https://www.yukoyuko.net/2274,〒410-3402,静岡県沼津市戸田３８７８−２０
里山の別邸 下田セントラルホテル,https://www.yukoyuko.net/2276,〒413-0711,静岡県下田市相玉１３３−１
熱海玉の湯ホテル,https://www.yukoyuko.net/2284,〒413-0014,静岡県熱海市渚町２６−１１
網代観光ホテル,https://www.yukoyuko.net/2285,〒413-0102,静岡県熱海市下多賀１３４
ホテルサンバレー伊豆長岡 本館,https://www.yukoyuko.net/2288,〒410-2211,静岡県伊豆の国市長岡６５９
ホテル河内屋,https://www.yukoyuko.net/2291,〒415-0303,静岡県賀茂郡南伊豆町下賀茂４３６−１
ホテルローレル,https://www.yukoyuko.net/2297,〒056-0016,北海道日高郡新ひだか町静内本町１―１―１
DEL style 名古屋納屋橋 by Daiwa Roynet Hotel,https://www.yukoyuko.net/2300,〒460-0008,愛知県名古屋市中区栄1-2-27
平野屋,https://www.yukoyuko.net/2301,〒443-0021,愛知県蒲郡市三谷町南山１−２１
西浦グランドホテル吉慶,https://www.yukoyuko.net/2302,〒443-0105,愛知県蒲郡市西浦町塩柄３
いいね！ホテル レシーア南知多,https://www.yukoyuko.net/2303,〒470-3322,愛知県知多郡南知多町山海字高座４１−３５
和のリゾート はづ,https://www.yukoyuko.net/2308,〒443-0105,愛知県蒲郡市西浦町大山１７−１
鈴岡,https://www.yukoyuko.net/2311,〒443-0102,愛知県蒲郡市金平町遊名田３−１４
みかわ温泉海遊亭,https://www.yukoyuko.net/2312,〒444-0702,愛知県西尾市寺部町笠外１８６−２
活魚の美舟,https://www.yukoyuko.net/2313,〒470-3503,愛知県知多郡南知多町師崎ぐみの木１２
天空海遊の宿　末広,https://www.yukoyuko.net/2315,〒443-0105,愛知県蒲郡市西浦町大山１７天空海遊の宿　末広
三河湾一望　天下の絶景　西浦温泉　ホテル東海園,https://www.yukoyuko.net/2317,〒443-0105,愛知県蒲郡市西浦町大山１７−１
ホテル三河 海陽閣,https://www.yukoyuko.net/2318,〒443-0021,愛知県蒲郡市三谷町南山１−６９
ホテルたつき,https://www.yukoyuko.net/2322,〒443-0105,愛知県蒲郡市西浦町大山２５
渚のリゾート　竜宮ホテル,https://www.yukoyuko.net/2324,〒444-0513,愛知県西尾市吉良町宮崎宮前１２
伊良湖リゾート＆コンベンションホテル,https://www.yukoyuko.net/2327,〒441-3624,愛知県田原市伊良湖町宮下２８２２−２
豆千待月,https://www.yukoyuko.net/2332,〒470-3321,愛知県知多郡南知多町内海新田６５
オテル・ド・マロニエ内海温泉,https://www.yukoyuko.net/2334,〒470-3321,愛知県知多郡南知多町内海小桝４０
松風園,https://www.yukoyuko.net/2335,〒443-0021,愛知県蒲郡市三谷町鳶欠１４−４
三谷温泉　ひがきホテル,https://www.yukoyuko.net/2339,〒443-0021,愛知県蒲郡市三谷町南山１−５９
伊良湖オーシャンリゾート,https://www.yukoyuko.net/2341,〒441-3623,愛知県田原市日出町骨山１４６０−３６
三河湾リゾートリンクス,https://www.yukoyuko.net/2349,〒444-0513,愛知県西尾市吉良町大字宮崎字中道下１５
旅館　ひさご,https://www.yukoyuko.net/2353,〒441-1631,愛知県新城市豊岡字大谷下４６−２旅館　ひさご
ホテル明山荘,https://www.yukoyuko.net/2355,〒443-0021,愛知県蒲郡市三谷町鳶欠１４−１
三河湾ヒルズ・ホテル（旧：グリーンホテル三ヶ根）,https://www.yukoyuko.net/2357,〒444-0701,愛知県西尾市東幡豆町入会山１−２８７本館
浜辺のホテル　松涛,https://www.yukoyuko.net/2361,〒470-3321,愛知県知多郡南知多町大字内海新田６４−１ホテル　松涛
水軍伝説の風薫る宿　花乃丸,https://www.yukoyuko.net/2363,〒470-3412,愛知県知多郡南知多町大字豊浜字廻間１７−１８
天の丸,https://www.yukoyuko.net/2365,〒444-0115,愛知県額田郡幸田町大字荻字遠峰１０
蒲郡クラシックホテル,https://www.yukoyuko.net/2368,〒443-0031,愛知県蒲郡市竹島町１５−１
ホテル メルパルク名古屋,https://www.yukoyuko.net/2369,〒461-0004,愛知県名古屋市東区葵３−１６−１６
内海温泉　いち豆,https://www.yukoyuko.net/2372,〒470-3321,愛知県知多郡南知多町内海新田４８−１
ロワジールホテル　豊橋,https://www.yukoyuko.net/2375,〒441-8061,愛知県豊橋市藤沢町１４１
ホテル　竹島,https://www.yukoyuko.net/2379,〒443-0031,愛知県蒲郡市竹島町１−６ホテル　竹島
ホテルウィングインターナショナル名古屋,https://www.yukoyuko.net/2380,〒460-0003,愛知県名古屋市中区錦１丁目４番地１１号ホテルウィングインターナショナル名古屋
名古屋東急ホテル,https://www.yukoyuko.net/2387,〒460-0008,愛知県名古屋市中区栄４−６−８名古屋東急ホテル
旬景浪漫　銀波荘,https://www.yukoyuko.net/2389,〒443-0105,愛知県蒲郡市西浦町大山２５
南知多温泉郷　源氏香,https://www.yukoyuko.net/2395,〒470-3322,愛知県知多郡南知多町山海屋敷103
ＴＨＥ　ＢＥＡＣＨ　ＫＵＲＯＴＡＫＥ,https://www.yukoyuko.net/2399,〒470-3321,愛知県知多郡南知多町大字内海字口揚４−６ＴＨＥ　ＢＥＡＣＨ　ＫＵＲＯＴＡＫＥ
寿々波,https://www.yukoyuko.net/2402,〒517-0002,三重県鳥羽市答志町７３５
伊勢志摩国立公園　賢島の宿　みち潮,https://www.yukoyuko.net/2405,〒517-0502,三重県志摩市阿児町神明７５４−９
海辺のお宿 浜千代館,https://www.yukoyuko.net/2414,〒519-0602,三重県伊勢市二見町茶屋５３７−２６
あじ彩の宿　小浜荘,https://www.yukoyuko.net/2418,〒517-0015,三重県鳥羽市小浜町２８８
オテル・ド・マロニエ湯の山温泉,https://www.yukoyuko.net/2425,〒510-1233,三重県三重郡菰野町菰野湯の山８５６３
海を望む全室露天風呂の宿　はいふう,https://www.yukoyuko.net/2427,〒517-0205,三重県志摩市磯部町渡鹿野５２４
美食とおもてなしの宿　旅荘海の蝶,https://www.yukoyuko.net/2428,〒519-0601,三重県伊勢市二見町松下１６９３−１
ホテル＆リゾーツ 伊勢志摩,https://www.yukoyuko.net/2431,〒517-0214,三重県志摩市磯部町的矢字笠取９３９−６
新八屋,https://www.yukoyuko.net/2432,〒517-0026,三重県鳥羽市石鏡町３３８−１
ホテル季の座,https://www.yukoyuko.net/2435,〒519-3204,三重県北牟婁郡紀北町東長島3043-4（城ノ浜）
志摩ビーチホテル,https://www.yukoyuko.net/2439,〒517-0032,三重県鳥羽市相差町１５２２−４０
美食の隠れ家 プロヴァンス,https://www.yukoyuko.net/2440,〒517-0502,三重県志摩市阿児町神明６６０ホテル　プロヴァンス
伊勢神宮のお膝元　鳥羽　胡蝶蘭,https://www.yukoyuko.net/2453,〒517-0015,三重県鳥羽市小浜町２３７−１
リゾートヒルズ豊浜 蒼空の風,https://www.yukoyuko.net/2456,〒517-0032,三重県鳥羽市相差町１４７１
ホテルアルティア鳥羽,https://www.yukoyuko.net/2457,〒517-0021,三重県鳥羽市安楽島町１０６１−９ホテルアルティア鳥羽
鳥羽ビューホテル 花真珠,https://www.yukoyuko.net/2459,〒517-0021,三重県鳥羽市安楽島町１０７５−９８
戸田家,https://www.yukoyuko.net/2462,〒517-0011,三重県鳥羽市鳥羽１−２４−２６
扇野の里 扇芳閣,https://www.yukoyuko.net/2463,〒517-0011,三重県鳥羽市鳥羽２丁目１２番２４号
プレミアリゾート 夕雅 伊勢志摩,https://www.yukoyuko.net/2466,〒517-0404,三重県志摩市浜島１６４５
鳥羽グランドホテル,https://www.yukoyuko.net/2469,〒517-0015,三重県鳥羽市小浜町２３９−９
伊勢かぐらばリゾート　千の杜,https://www.yukoyuko.net/2470,〒516-1102,三重県伊勢市佐八町字池の上１１６５−１
美杉リゾート ホテルＡＮＮＥＸ,https://www.yukoyuko.net/2471,〒515-3421,三重県津市美杉町八知５９９０ホテル　ＡＮＮＥＸ
石鏡第一ホテル神倶良,https://www.yukoyuko.net/2473,〒517-0026,三重県鳥羽市石鏡町３３８−５
彩　向陽,https://www.yukoyuko.net/2474,〒510-1233,三重県三重郡菰野町菰野８４９７
磨洞温泉　涼風荘,https://www.yukoyuko.net/2479,〒514-0823,三重県津市半田２８６０−１
二見温泉　ホテル清海,https://www.yukoyuko.net/2480,〒519-0601,三重県伊勢市二見町松下１３４９−１３６
ホテル湯の本,https://www.yukoyuko.net/2481,〒510-1233,三重県三重郡菰野町菰野８４９７
檜扇荘,https://www.yukoyuko.net/2485,〒517-0501,三重県志摩市阿児町鵜方９４３−１
都リゾート 志摩 ベイサイドテラス,https://www.yukoyuko.net/2486,〒517-0501,三重県志摩市阿児町鵜方３６１８−３３
都リゾート奥志摩アクアフォレスト,https://www.yukoyuko.net/2487,〒517-0604,三重県志摩市大王町船越３２３８−１
相差パシフィックホテル,https://www.yukoyuko.net/2489,〒517-0032,三重県鳥羽市相差町1522-31相差パシフィックホテル
海辺のホテル　はな,https://www.yukoyuko.net/2490,〒517-0205,三重県志摩市磯部町渡鹿野４１４−１
ヒルホテル　サンピア伊賀,https://www.yukoyuko.net/2491,〒518-0809,三重県伊賀市西明寺２７５６−１０４ヒルホテル　サンピア伊賀
味の宿みち潮,https://www.yukoyuko.net/2493,〒517-0032,三重県鳥羽市相差町１５２２−１２
湯の山温泉　グリーンホテル,https://www.yukoyuko.net/2495,〒510-1251,三重県三重郡菰野町千草７０５４−１７３
波音の宿　中村屋,https://www.yukoyuko.net/2499,〒517-0002,三重県鳥羽市答志町２１３７番地３
暖灯館　きくのや,https://www.yukoyuko.net/2502,〒520-0101,滋賀県大津市雄琴６−１−２９
びわ湖大津プリンスホテル,https://www.yukoyuko.net/2505,〒520-8520,滋賀県大津市におの浜４−７−７
須賀谷温泉,https://www.yukoyuko.net/2518,〒526-0277,滋賀県長浜市須賀谷町３６須賀谷温泉
天然源泉の宿　ことゆう,https://www.yukoyuko.net/2520,〒520-0102,滋賀県大津市苗鹿３丁目９−５
里湯昔話　雄山荘,https://www.yukoyuko.net/2521,〒520-0101,滋賀県大津市雄琴　１−９−２８
ホテル＆リゾーツ 長浜,https://www.yukoyuko.net/2522,〒526-0066,滋賀県長浜市大島町３８
琵琶湖ホテル,https://www.yukoyuko.net/2523,〒520-0041,滋賀県大津市浜町２番４０号
百日紅（さるすべり）の宿　丸中旅館,https://www.yukoyuko.net/2525,〒390-0221,長野県松本市大字里山辺451
HOTEL　KANADE　関空貝塚,https://www.yukoyuko.net/2526,〒597-0061,大阪府貝塚市浦田７５−１
湯の山温泉　三慶園,https://www.yukoyuko.net/2528,〒510133,三重県三重郡菰野町大字菰野８５２０
花小路　彩月,https://www.yukoyuko.net/2530,〒669-6101,兵庫県豊岡市城崎町湯島108
博多の宿 徒然庵,https://www.yukoyuko.net/2532,〒812-0029,福岡県福岡市博多区古門戸町4番4
滝本館,https://www.yukoyuko.net/2533,〒436-0342,静岡県掛川市上西郷５１７４−１
山の宿　寒の地獄旅館,https://www.yukoyuko.net/2534,〒879-4911,大分県玖珠郡九重町大字田野257
クレフィール湖東,https://www.yukoyuko.net/2535,〒527-0102,滋賀県東近江市平柳町２２−３
奥琵琶湖マキノグランドパークホテル,https://www.yukoyuko.net/2542,〒520-1812,滋賀県高島市マキノ町西浜７６３−２
北近江観音路　己高庵,https://www.yukoyuko.net/2545,〒529-0411,滋賀県長浜市木之本町古橋１０９４
南郷温泉　二葉屋,https://www.yukoyuko.net/2547,〒520-0865,滋賀県大津市南郷５−１５−７
琵琶レイクオーツカ,https://www.yukoyuko.net/2548,〒520-0502,滋賀県大津市南小松１０５４−３
おごと温泉　びわ湖花街道,https://www.yukoyuko.net/2550,〒520-0101,滋賀県大津市雄琴１−１−３
ダイヤモンド滋賀ホテル,https://www.yukoyuko.net/2553,〒528-0208,滋賀県甲賀市土山町黒川１７１１
アーバンホテル草津,https://www.yukoyuko.net/2555,〒525-0032,滋賀県草津市大路１−４−３１
アーバンホテル南草津,https://www.yukoyuko.net/2556,〒525-0050,滋賀県草津市南草津１−１−５
琵琶湖グランドホテル・京近江,https://www.yukoyuko.net/2562,〒520-0101,滋賀県大津市雄琴6-5-1
亀の井ホテル 彦根,https://www.yukoyuko.net/2563,〒522-0002,滋賀県彦根市松原町3759
ホテルルートイン彦根,https://www.yukoyuko.net/2564,〒522-0027,滋賀県彦根市東沼波町１１１−３
湖北ノ空、二人ノ宿 きひろ,https://www.yukoyuko.net/2567,〒529-0364,滋賀県長浜市湖北町尾上３１３-１３
比良招福温泉 ホリデーアフタヌーン,https://www.yukoyuko.net/2568,〒520-0503,滋賀県大津市北比良948-10
ホテルボストンプラザ草津びわ湖,https://www.yukoyuko.net/2572,〒525-0037,滋賀県草津市西大路町１−２７草津駅西口 ボストンスクエア 内
あじさいの宿　都荘,https://www.yukoyuko.net/2573,〒849-3223,佐賀県唐津市相知町伊岐佐乙568-2
グランヴィレッヂ洞爺　大和旅館アネックス,https://www.yukoyuko.net/2574,〒049-5721,北海道虻田郡洞爺湖町洞爺湖温泉34-4
志賀高原　白い温泉　渓谷の湯,https://www.yukoyuko.net/2577,〒381-0401,長野県下高井郡山ノ内町平穏7148
榊原温泉　神湯館,https://www.yukoyuko.net/2579,〒514-1251,三重県津市榊原町5079
松川渓谷に佇む宿　信州山田温泉　山田館,https://www.yukoyuko.net/2582,〒382-0816,長野県上高井郡高山村山田温泉3604
静鉄ホテルプレジオ京都四条,https://www.yukoyuko.net/2583,〒604-8227,京都府京都市中京区西洞院通錦小路上る古西町452
湯けむりの宿　稲住温泉（共立リゾート）,https://www.yukoyuko.net/2584,〒019-0321,秋田県湯沢市秋ノ宮字山居野11
磐梯名湯リゾート　ボナリの森,https://www.yukoyuko.net/2585,〒969-2752,福島県耶麻郡猪苗代町蚕養沼尻山甲2855-550
信州八重原温泉　アートヴィレッジ明神館,https://www.yukoyuko.net/2586,〒389-0406,長野県長野県東御市八重原1806-1
玉造温泉佳翠苑皆美,https://www.yukoyuko.net/2587,〒699-0201,島根県松江市玉湯町玉造1218-8
桓武平氏ゆかりの宿　揚羽　〜AGEHA〜,https://www.yukoyuko.net/2588,〒321-2601,栃木県日光市湯西川727
奥松島 LANE HOTEL,https://www.yukoyuko.net/2594,〒981-0416,宮城県東松島市野蒜ケ丘3丁目29-1
龍宮城スパ・ホテル三日月　富士見亭,https://www.yukoyuko.net/2597,〒292-0006,千葉県木更津市北浜町1番地
銀山温泉　古勢起屋別館,https://www.yukoyuko.net/2598,〒999-4333,山形県尾花沢市大字銀山新畑417
銀山温泉　仙峡の宿　銀山荘,https://www.yukoyuko.net/2599,〒999-4333,山形県尾花沢市大字銀山新畑85
HOTEL Areaone Koshiki Island,https://www.yukoyuko.net/2600,〒896-1101,鹿児島県薩摩川内市里町里1619-15
京湯元　ハトヤ瑞鳳閣,https://www.yukoyuko.net/2611,〒600-8234,京都府京都市下京区西洞院塩小路下ル南不動堂町８０２番地
リーガロイヤルホテル京都,https://www.yukoyuko.net/2615,〒600-8237,京都府京都市下京区東堀川通塩小路下る松明町１番地リ−ガロイヤルホテル京都
ハートンホテル京都,https://www.yukoyuko.net/2618,〒604-0836,京都府京都市中京区東洞院通御池上ル船屋町４０５
ザ・プリンス 京都宝ヶ池,https://www.yukoyuko.net/2620,〒606-8505,京都府京都市左京区宝ヶ池
みのり旅館,https://www.yukoyuko.net/2622,〒629-3245,京都府京丹後市網野町浜詰４６−１３
シーサイド佐竹,https://www.yukoyuko.net/2625,〒629-3104,京都府京丹後市網野町浅茂川1980
天橋立ホテル,https://www.yukoyuko.net/2627,〒626-0001,京都府宮津市字文珠310
ホテル＆リゾーツ 京都 宮津,https://www.yukoyuko.net/2632,〒626-8510,京都府宮津市字田井小字岩本５８
るり渓温泉　こぶし荘　花あかり,https://www.yukoyuko.net/2633,〒622-0065,京都府南丹市園部町大河内広谷１−８
ギオン福住,https://www.yukoyuko.net/2641,〒605-0062,京都府京都市東山区東大路新橋西入林下町437番地
京都・嵐山　ご清遊の宿　　らんざん,https://www.yukoyuko.net/2659,〒616-8385,京都府京都市右京区嵯峨天龍寺芒ノ馬場町３３
城崎　温もりの宿　ひだまり,https://www.yukoyuko.net/2660,〒669-6123,兵庫県豊岡市小島１１８８−８
久美の浜　みなと悠悠,https://www.yukoyuko.net/2661,〒629-3422,京都府京丹後市久美浜町湊宮２１０２−１本館（５階建て）
ホテルモントレ京都,https://www.yukoyuko.net/2667,〒604-8161,京都府京都市中京区烏丸通三条下ル饅頭屋町６０４
夕日浪漫　一望館,https://www.yukoyuko.net/2668,〒629-3245,京都府京丹後市網野町浜詰２６６
時季を彩る　佳松苑,https://www.yukoyuko.net/2669,〒629-3241,京都府京丹後市網野町木津２４７
おもてなしの宿　渓山閣,https://www.yukoyuko.net/2671,〒621-0033,京都府亀岡市ひえ田野町佐伯下峠２０−６
オーベルジュ天橋立,https://www.yukoyuko.net/2673,〒626-0001,京都府宮津市文珠３１０番地オーベルジュ天橋立
夕日ヶ浦温泉　海舟,https://www.yukoyuko.net/2677,〒629-3245,京都府京丹後市網野町浜詰４６−４
京都嵐山温泉　花伝抄（共立リゾート）,https://www.yukoyuko.net/2678,〒616-0003,京都府京都市西京区嵐山西一川町５−４
１日７組　露天風呂付きはなれ客室　いっぺん庵,https://www.yukoyuko.net/2679,〒629-3424,京都府京丹後市久美浜町蒲井５２２−１
ホテル京阪 京都 グランデ,https://www.yukoyuko.net/2680,〒601-8003,京都府京都市南区東九条西山王町３１番地
三井ガーデンホテル京都三条,https://www.yukoyuko.net/2691,〒604-8166,京都府京都市中京区三条通烏丸西入御倉町８０番地
千里阪急ホテル,https://www.yukoyuko.net/2709,〒560-0082,大阪府豊中市新千里東町２丁目１
ホテルセイリュウ,https://www.yukoyuko.net/2710,〒579-8012,大阪府東大阪市上石切町１−１１−１２
ホテルモントレ　ラ・スール大阪,https://www.yukoyuko.net/2711,〒540-0001,大阪府大阪市中央区城見２丁目２番２２号
関空温泉ホテル ガーデンパレス,https://www.yukoyuko.net/2718,〒598-0013,大阪府泉佐野市中町１−３−５１
ホテル京阪 ユニバーサル・タワー,https://www.yukoyuko.net/2724,〒554-0024,大阪府大阪市此花区島屋６−２−４５
大阪東急ＲＥＩホテル,https://www.yukoyuko.net/2726,〒530-0027,大阪府大阪市北区堂山町２−１
ホテル アゴーラ 大阪守口,https://www.yukoyuko.net/2733,〒570-0038,大阪府守口市河原町１０番５号
ホテル京阪京橋グランデ,https://www.yukoyuko.net/2737,〒534-0024,大阪府大阪市都島区東野田町２丁目１の３８
ホテル アゴーラ リージェンシー 大阪堺,https://www.yukoyuko.net/2740,〒590-0985,大阪府堺市堺区戎島町４−４５−１
み奈美亭,https://www.yukoyuko.net/2746,〒598-0023,大阪府泉佐野市大木２２３６
八尾グランドホテル,https://www.yukoyuko.net/2749,〒581-0016,大阪府八尾市八尾木北５−１０１
ホテル京阪天満橋,https://www.yukoyuko.net/2751,〒540-0012,大阪府大阪市中央区谷町１丁目２−１０
かねよし旅館,https://www.yukoyuko.net/2752,〒542-0084,大阪府大阪市中央区宗右衛門町３−１２
三井ガーデンホテル大阪プレミア,https://www.yukoyuko.net/2756,〒530-0005,大阪府大阪市北区中之島３−４−１５
大江戸温泉物語 箕面観光ホテル,https://www.yukoyuko.net/2758,〒562-0006,大阪府箕面市温泉町1-1
大阪リバーサイドホテル,https://www.yukoyuko.net/2762,〒534027,大阪府大阪市都島区中野町５丁目１２番３０号
ホテルウィングインターナショナルセレクト大阪梅田,https://www.yukoyuko.net/2763,〒530-0026,大阪府大阪市北区神山町8-4
ホテルウィングインターナショナルセレクト東大阪,https://www.yukoyuko.net/2764,〒577-0012,大阪府東大阪市長田東2-1-2
アズガーデン日本橋,https://www.yukoyuko.net/2765,〒542-0084,大阪府大阪市中央区宗右衛門町１-６
天然温泉　河内長野荘,https://www.yukoyuko.net/2770,〒586-0051,大阪府河内長野市末広町3-25
クインテッサホテル大阪心斎橋 Comic & Books,https://www.yukoyuko.net/2771,〒542-0083,大阪府大阪市中央区東心斎橋1-8-21
クインテッサホテル大阪ベイ,https://www.yukoyuko.net/2772,〒559-0034,大阪府大阪市住之江区南港北1-13-65
ホテルソビアル なんば大国町,https://www.yukoyuko.net/2773,〒556-0015,大阪府大阪市浪速区敷津西2-2-4
アークホテル大阪心斎橋,https://www.yukoyuko.net/2778,〒542-0082,大阪府大阪市中央区島之内１−１９−１８
ハタゴイン関西空港,https://www.yukoyuko.net/2779,〒598-0048,大阪府泉佐野市りんくう往来北２−８５
はなれの宿 千の森,https://www.yukoyuko.net/2783,〒869-2231,熊本県阿蘇市永草1983-1
珠玉の湯　薬師堂温泉,https://www.yukoyuko.net/2784,〒023-0003,岩手県奥州市水沢佐倉河薬師堂27
山の神温泉　別墅　清流館,https://www.yukoyuko.net/2785,〒025-0253,岩手県花巻市下シ沢字中野66番地
大江戸温泉物語Premium 汐美荘,https://www.yukoyuko.net/2786,〒958-0037,新潟県新潟県村上市瀬波温泉2-9-36
グランヴィリオホテル宮島和蔵　ルートインホテルズ,https://www.yukoyuko.net/2787,〒739-0412,広島県廿日市市宮島口西1丁目1-37
新大阪江坂東急REIホテル,https://www.yukoyuko.net/2788,〒564-0051,大阪府吹田市豊津町9-6
グランドホテル浜松,https://www.yukoyuko.net/2790,〒432-8036,静岡県浜松市中央区東伊場1-3-1
ホテルクラウンパレス浜松,https://www.yukoyuko.net/2791,〒430-8511,静岡県浜松市中央区板屋町110-17
テンザ ホテル・仙台ステーション,https://www.yukoyuko.net/2792,〒983-0852,宮城県仙台市宮城野区榴岡４丁６−２８
テンザ ホテル＆スカイスパ・札幌セントラル,https://www.yukoyuko.net/2793,〒060-0062,北海道札幌市中央区南２条西８丁目
ふくせんか,https://www.yukoyuko.net/2794,〒839-1405,福岡県うきは市浮羽町古川1099-8
THE QUBE HOTEL Chiba,https://www.yukoyuko.net/2795,〒260-0025,千葉県千葉市中央区問屋町1-45千葉ポートスクエア
ビジネスホテル富士見,https://www.yukoyuko.net/2796,〒413-0513,山梨県富士吉田市富士見６ー１３ー１７
TAOYA秋保,https://www.yukoyuko.net/2798,〒982-0241,宮城県仙台市太白区秋保町湯元字薬師107
安田温泉 やすらぎ,https://www.yukoyuko.net/2800,〒959-2211,新潟県阿賀野市保田6075-3
ねぎや陵楓閣,https://www.yukoyuko.net/2803,〒651-1401,兵庫県神戸市北区有馬町１５３７−２
淡路インターナショナルホテル ザ・サンプラザ,https://www.yukoyuko.net/2805,〒656-0023,兵庫県洲本市小路谷１２７９−１３
神戸 西神オリエンタルホテル,https://www.yukoyuko.net/2806,〒651-2273,兵庫県神戸市西区糀台５−６−３
ホテルグリーンプラザ東条湖,https://www.yukoyuko.net/2807,〒673-1412,兵庫県加東市廻淵字東山３１７
有馬ロイヤルホテル,https://www.yukoyuko.net/2808,〒651-1401,兵庫県神戸市北区有馬町９８７
御幸荘 花結び,https://www.yukoyuko.net/2811,〒651-1401,兵庫県神戸市北区有馬町３５１
寿楼　臨水亭,https://www.yukoyuko.net/2814,〒654-0071,兵庫県神戸市須磨区須磨寺町３−５−１８
淡路島観光ホテル,https://www.yukoyuko.net/2815,〒656-0023,兵庫県洲本市小路谷１０５３−１７
シーサイドホテル舞子ビラ神戸,https://www.yukoyuko.net/2816,〒655-0047,兵庫県神戸市垂水区東舞子町１８−１１
メルヴェール有馬,https://www.yukoyuko.net/2818,〒651-1401,兵庫県神戸市北区有馬町ウツギ谷１６７０−５
赤穂パークホテル,https://www.yukoyuko.net/2820,〒678-0226,兵庫県赤穂市さつき町３６−１２
