湯の宿　福寿草,https://www.yukoyuko.net/5668,〒389-0806,長野県千曲市大字磯部　１０８９湯の宿　福寿草
心がふれあう民芸の宿　中央ホテル,https://www.yukoyuko.net/5673,〒389-0821,長野県千曲市上山田温泉１−３８−１
野沢温泉ホテル,https://www.yukoyuko.net/5674,〒389-2502,長野県下高井郡野沢温泉村豊郷７９２３−３
ホテルシルクイン斑尾,https://www.yukoyuko.net/5675,〒389-2257,長野県飯山市斑尾高原１１４９２−３７７ホテルシルクイン斑尾
ホテル水明館【伊東園ホテルズ】,https://www.yukoyuko.net/5676,〒381-0401,長野県下高井郡山ノ内町平穏２９４１
AMBIENT 安曇野ホテル,https://www.yukoyuko.net/5681,〒399-8305,長野県安曇野市穂高牧２２３０ホテルアンビエント安曇野
立山プリンスホテル,https://www.yukoyuko.net/5687,〒398-0001,長野県大町市大町平２８８４−１０
亀清旅館,https://www.yukoyuko.net/5693,〒389-0821,長野県千曲市上山田温泉２−１５−１
白馬樅の木ホテル,https://www.yukoyuko.net/5695,〒399-9301,長野県北安曇群白馬村北城４６８３−２
上高地ホテル,https://www.yukoyuko.net/5699,〒390-1514,長野県松本市安曇沢渡４１７１番地
野地温泉ホテル,https://www.yukoyuko.net/5702,〒960-2157,福島県福島市土湯温泉町字鷲倉山１−２
旅館ひのえまた,https://www.yukoyuko.net/5705,〒967-0521,福島県南会津郡桧枝岐村居平７０５
福住旅館,https://www.yukoyuko.net/5711,〒960-0201,福島県福島市飯坂町字若葉町27番地福住旅館
幕川温泉　水戸屋旅館,https://www.yukoyuko.net/5721,〒960-2157,福島県福島市土湯温泉町字鷲倉山１−３
渓苑　花の瀬,https://www.yukoyuko.net/5724,〒960-0211,福島県福島市飯坂町湯野字新湯７
スパリゾートハワイアンズ　 ホテルハワイアンズ,https://www.yukoyuko.net/5734,〒972-8326,福島県いわき市常磐藤原町蕨平５０番地
いわき湯本温泉　ときわの宿　浜とく,https://www.yukoyuko.net/5739,〒972-8326,福島県いわき市常磐藤原町蕨平３２番地
アクティブリゾーツ　裏磐梯,https://www.yukoyuko.net/5741,〒969-2701,福島県耶麻郡北塩原村大字桧原字剣ヶ峯　１０９３−３０９
鮮の宿　柏,https://www.yukoyuko.net/5742,〒972-8321,福島県いわき市常磐湯本町三函１９６
ホテル華の湯,https://www.yukoyuko.net/5744,〒963-1387,福島県郡山市熱海町熱海５−８−６０ホテル華の湯
山房　月之瀬,https://www.yukoyuko.net/5747,〒960-0201,福島県福島市飯坂町北原７
湯のやど　楽山,https://www.yukoyuko.net/5748,〒963-1309,福島県郡山市熱海町熱海５−３９
ホテルウィングインターナショナル須賀川,https://www.yukoyuko.net/5749,〒962-0845,福島県須賀川市中町３６−１
芦ノ牧プリンスホテル,https://www.yukoyuko.net/5750,〒969-5147,福島県会津若松市大戸町芦ノ牧１０５０
水林亭,https://www.yukoyuko.net/5752,〒963-1309,福島県郡山市熱海町熱海５丁目４３番水林亭
花木の宿,https://www.yukoyuko.net/5754,〒967-0515,福島県南会津郡南会津町大字大桃字平沢山１０４１番地１
大川荘,https://www.yukoyuko.net/5756,〒969-5147,福島県会津若松市大戸町大字芦ノ牧字下平９８４
郡山ビューホテルアネックス,https://www.yukoyuko.net/5757,〒963-8004,福島県郡山市中町１０−１０
土湯温泉　山根屋旅館,https://www.yukoyuko.net/5760,〒960-2157,福島県福島市土湯温泉町字油畑３番地
原瀧,https://www.yukoyuko.net/5761,〒965-0814,福島県会津若松市東山町湯本２３５
今昔亭,https://www.yukoyuko.net/5762,〒965-0814,福島県会津若松市東山町湯本２４７
大玉リゾートヒルズホテル,https://www.yukoyuko.net/5763,〒969-1302,福島県安達郡大玉村玉井字北上台２５番地
泉崎さつき温泉　泉崎カントリーヴィレッジ,https://www.yukoyuko.net/5766,〒969-0101,福島県西白河郡泉崎村大字泉崎字笹立山１２
裏磐梯レイクリゾート  （五色の森）,https://www.yukoyuko.net/5771,〒969-2701,福島県耶麻郡北塩原村大字桧原字湯平山１１７１−１
東山パークホテル新風月【伊東園ホテルズ】,https://www.yukoyuko.net/5772,〒965-0814,福島県会津若松市東山町大字湯本字積り９９
鏡が池碧山亭【伊東園ホテルズ】,https://www.yukoyuko.net/5773,〒964-0074,福島県二本松市岳温泉
伊東園ホテル飯坂叶や,https://www.yukoyuko.net/5774,〒960-0211,福島県福島市飯坂町湯野字上川原２−４
裏磐梯レイクリゾート　迎賓館・猫魔離宮,https://www.yukoyuko.net/5776,〒969-2701,福島県耶麻郡北塩原村大字桧原字湯平山１１７１−１
大江戸温泉物語 東山グランドホテル,https://www.yukoyuko.net/5781,〒965-0814,福島県会津若松市東山町湯本字上湯本5
ルネサンス棚倉,https://www.yukoyuko.net/5782,〒963-6123,福島県東白川郡棚倉町関口字一本松43-1
伊東園ホテル磐梯向滝,https://www.yukoyuko.net/5783,〒963-1309,福島県郡山市熱海町熱海5-295伊東園ホテル磐梯向滝
渓流展望貸切露天の宿 奥土湯温泉峡　小滝温泉,https://www.yukoyuko.net/5784,〒960-2157,福島県福島市土湯温泉町字下隠台8番地
大江戸温泉物語 あいづ,https://www.yukoyuko.net/5785,〒965-0062,福島県会津若松市神指町北四合字東神指77-1
二岐温泉　柏屋旅館,https://www.yukoyuko.net/5789,〒962-0621,福島県岩瀬郡天栄村湯本下二俣22-6
ｍｔ．ｉｎｎ,https://www.yukoyuko.net/5790,〒964-0074,福島県二本松市岳温泉1-7
貸別荘&コテージ オール・リゾート・サービス,https://www.yukoyuko.net/5791,〒969-3111,福島県耶麻郡猪苗代町出雲壇３５−１
祭屋　湯左衛門,https://www.yukoyuko.net/5794,〒960-0201,福島県福島市飯坂町鍋沢4-1
元湯　有馬屋旅館,https://www.yukoyuko.net/5795,〒965-0814,福島県会津若松市東山町湯本居平118
月光園　游月山荘,https://www.yukoyuko.net/5801,〒651-1401,兵庫県神戸市北区有馬町３１８
城崎温泉 泉翠,https://www.yukoyuko.net/5803,〒669-6101,兵庫県豊岡市城崎町湯島７５３番地
夕香楼 しょう和,https://www.yukoyuko.net/5804,〒669-6546,兵庫県美方郡香美町香住区七日市３１２−１夕香楼　しょう和
ダイヤモンド有馬温泉ソサエティ 本館,https://www.yukoyuko.net/5805,〒651-1401,兵庫県神戸市北区有馬町４２３
神戸ハーバーランド温泉　万葉倶楽部,https://www.yukoyuko.net/5808,〒650-0044,兵庫県神戸市中央区東川崎町１−８−１プロメナ神戸
ＨＯＴＥＬ　万葉岬,https://www.yukoyuko.net/5809,〒678-0041,兵庫県相生市相生字金ヶ崎５３２１
鹿久居荘　赤穂,https://www.yukoyuko.net/5810,〒678-0226,兵庫県赤穂市さつき町３５−５鹿久居荘　赤穂
淡海荘,https://www.yukoyuko.net/5812,〒656-2401,兵庫県淡路市岩屋３５５９−４
有馬グランドホテル,https://www.yukoyuko.net/5814,〒651-1401,兵庫県神戸市北区有馬町１３０４−１
月光園　鴻朧館,https://www.yukoyuko.net/5815,〒651-1401,兵庫県神戸市北区有馬町３１８
スプリングゴルフ＆アートリゾート淡路,https://www.yukoyuko.net/5819,〒656-1301,兵庫県洲本市五色町都志1151
ホテルウィングインターナショナル姫路,https://www.yukoyuko.net/5820,〒670-0921,兵庫県姫路市綿町１３２ホテルウィングインターナショナル姫路
浜坂温泉 魚と屋,https://www.yukoyuko.net/5821,〒669-6701,兵庫県美方郡新温泉町芦屋６６３
湯村温泉 魚と屋,https://www.yukoyuko.net/5829,〒669-6821,兵庫県美方郡新温泉町湯１５９９−１
ホテルクラウンパレス神戸,https://www.yukoyuko.net/5830,〒650-0044,兵庫県神戸市中央区東川崎町１−３−５
懐石宿　潮里,https://www.yukoyuko.net/5831,〒671-1301,兵庫県たつの市御津町黒崎１４０４
東山温泉メイプルプラザ,https://www.yukoyuko.net/5834,〒671-4221,兵庫県宍粟市波賀町上野１７９９−６
佳泉郷　井づつや,https://www.yukoyuko.net/5838,〒669-6821,兵庫県美方郡新温泉町湯１５３５
ホテルパールシティ神戸,https://www.yukoyuko.net/5839,〒650-0046,兵庫県神戸市中央区港島中町７−５−１ホテルパールシティ神戸
ＴＯＴＯシーウィンド淡路,https://www.yukoyuko.net/5841,〒656-2143,兵庫県淡路市里５７３−１４ＴＯＴＯシーウィンド淡路
城崎温泉　医食同源の宿　かに庵,https://www.yukoyuko.net/5846,〒669-6101,兵庫県豊岡市城崎町湯島６９０
神戸　ホテル　フルーツ・フラワー,https://www.yukoyuko.net/5847,〒651-1522,兵庫県神戸市北区大沢町上大沢２１５０
うめ丸,https://www.yukoyuko.net/5849,〒656-0661,兵庫県南あわじ市阿那賀１１３７−９
サンセットビューホテルけひの海,https://www.yukoyuko.net/5851,〒656-0304,兵庫県南あわじ市松帆古津路９７０−７６
姫路市休養センター 香寺荘,https://www.yukoyuko.net/5852,〒679-2165,兵庫県姫路市香寺町恒屋１４７０
リブマックスリゾート瀬戸内シーフロント,https://www.yukoyuko.net/5854,〒671-1332,兵庫県たつの市御津町室津８９５−２８
神戸北野ホテル,https://www.yukoyuko.net/5857,〒650-0003,兵庫県神戸市中央区山本通３丁目３番２０号
兵衛向陽閣,https://www.yukoyuko.net/5859,〒651-1401,兵庫県神戸市北区有馬町１９０４
峰山高原ホテルリラクシア,https://www.yukoyuko.net/5861,〒679-3125,兵庫県神崎郡 神河町上小田８８１−１４６
ホテル金波楼,https://www.yukoyuko.net/5863,〒669-6192,兵庫県豊岡市瀬戸１０９０
湧泉の宿　ゆあむ,https://www.yukoyuko.net/5864,〒669-6821,兵庫県美方郡新温泉町湯１６１０
神戸みなと温泉 蓮,https://www.yukoyuko.net/5865,〒650-0041,兵庫県神戸市中央区新港町１−１
宝塚温泉　ホテル若水,https://www.yukoyuko.net/5867,〒665-0003,兵庫県宝市湯本町９−２５
ホテルヒューイット甲子園,https://www.yukoyuko.net/5868,〒663-8166,兵庫県西宮市甲子園高潮町３−３０
姫路キヤッスルグランヴィリオホテル,https://www.yukoyuko.net/5869,〒670-0940,兵庫県姫路市三左衛門堀西の町２１０
有馬温泉　小都里,https://www.yukoyuko.net/5870,〒651-1401,兵庫県神戸市北区有馬町３５３−１
新舞子ガーデンホテル,https://www.yukoyuko.net/5874,〒671-1301,兵庫県たつの市御津町黒崎１７１０
湯快リゾートプレミアム　湯村温泉　三好屋,https://www.yukoyuko.net/5875,〒669-6821,兵庫県美方郡新温泉町湯1671-3
大江戸温泉物語Premium きのさき,https://www.yukoyuko.net/5879,〒669-6102,兵庫県豊岡市城崎町桃島1232
ニューサンピア姫路ゆめさき,https://www.yukoyuko.net/5880,〒671-2122,兵庫県姫路市夢前町置本432-56
有馬温泉　上大坊,https://www.yukoyuko.net/5881,〒651140,兵庫県神戸市北区有馬町1175
香住　柴山　夕庵,https://www.yukoyuko.net/5882,〒669-6433,兵庫県美方郡香美町香住区沖浦939-1
有馬温泉　陶泉　御所坊,https://www.yukoyuko.net/5884,〒651-1401,兵庫県神戸市北区有馬町858
有馬温泉　ホテル花小宿,https://www.yukoyuko.net/5885,〒651-1401,兵庫県神戸市北区有馬町1007
旅湯　アブリーゴ,https://www.yukoyuko.net/5886,〒651-1401,兵庫県神戸市北区有馬町835
有馬山叢　御所別墅（ありまさんそう　ごしょべっしょ）,https://www.yukoyuko.net/5887,〒651-1401,兵庫県神戸市北区有馬町958
亀の井ホテル 有馬,https://www.yukoyuko.net/5888,〒651-1401,兵庫県神戸市北区有馬町1617-1
ハチ北温泉　内湯旅館　ＳＡＳＡＹＡ,https://www.yukoyuko.net/5889,〒667-1344,兵庫県美方郡香美町村岡区大笹687
波音の宿　くろしお,https://www.yukoyuko.net/5890,〒669-6402,兵庫県美方郡香美町香住区訓谷114
城崎温泉　かけ流しの宿　山しろや旅館,https://www.yukoyuko.net/5893,〒669-6101,兵庫県豊岡市城崎町湯島245
ホテルモルゲンロート,https://www.yukoyuko.net/5898,〒651-1401,兵庫県神戸市北区有馬町1039-5
ほてる白河　湯の蔵,https://www.yukoyuko.net/5900,〒321-2526,栃木県日光市鬼怒川温泉滝４８３
ものぐさの宿　花千郷,https://www.yukoyuko.net/5901,〒321-2526,栃木県日光市鬼怒川温泉滝４８２−６
きぬ川国際ホテル,https://www.yukoyuko.net/5915,〒321-2526,栃木県日光市鬼怒川温泉滝５４０
渓流の宿　緑水,https://www.yukoyuko.net/5916,〒321-2526,栃木県日光市鬼怒川温泉滝８６１−３
こだまの湯　山口屋旅館,https://www.yukoyuko.net/5918,〒329-2921,栃木県那須塩原市塩原７０３
湯荘　白樺,https://www.yukoyuko.net/5924,〒329-2922,栃木県那須塩原市湯本塩原１４
奥日光小西ホテル,https://www.yukoyuko.net/5926,〒321-1662,栃木県日光市湯元２５４９−５
ホテルハーヴェスト鬼怒川,https://www.yukoyuko.net/5927,〒321-2522,栃木県日光市鬼怒川温泉大原１４−１０
ホテルカジュアルユーロ,https://www.yukoyuko.net/5931,〒321-1421,栃木県日光市所野１５５０−３８
ホテルユーロシティ,https://www.yukoyuko.net/5932,〒321-1421,栃木県日光市所野１５５０−８９
自噴源泉の湯　コリーナ矢板,https://www.yukoyuko.net/5937,〒329-1576,栃木県矢板市石関１１２１番地１０７コリーナ矢板
鬼怒川仁王尊プラザ,https://www.yukoyuko.net/5939,〒321-2522,栃木県日光市鬼怒川温泉大原３７１−１
奥塩原高原ホテル,https://www.yukoyuko.net/5940,〒329-2922,栃木県那須塩原市湯本塩原１１３−４
日光ステーションホテルクラシック,https://www.yukoyuko.net/5941,〒321-1413,栃木県日光市相生町３−１
塩原元湯温泉　秘湯の宿　元泉館,https://www.yukoyuko.net/5942,〒329-2922,栃木県那須塩原市湯本塩原１０１
日光　星の宿,https://www.yukoyuko.net/5945,〒321-1401,栃木県日光市上鉢石町１１１５番地
乃木温泉ホテル,https://www.yukoyuko.net/5948,〒329-2712,栃木県那須塩原市下永田１−９９３−１１
那須陽光ホテル,https://www.yukoyuko.net/5949,〒329-3441,栃木県那須郡那須町寄居３９３−１
ほのかな宿　樹林,https://www.yukoyuko.net/5950,〒321-1662,栃木県日光市湯元２５４９−７
ホテルフロラシオン那須,https://www.yukoyuko.net/5951,〒325-0302,栃木県栃木県那須郡那須町高久丙１７９６
大金温泉グランドホテル,https://www.yukoyuko.net/5953,〒321-0521,栃木県那須烏山市岩子８６−２大金温泉グランドホテル
上屋敷　平の高房,https://www.yukoyuko.net/5954,〒321-2601,栃木県日光市湯西川１４８３
塩原温泉 常盤ホテル,https://www.yukoyuko.net/5956,〒329-2921,栃木県那須塩原市塩原６９５
ガストホフ那須花,https://www.yukoyuko.net/5958,〒325-0303,栃木県那須郡那須町高久乙３４４２
旅館　まじま荘,https://www.yukoyuko.net/5959,〒329-2923,栃木県那須塩原市　上塩原５８０
奥那須・大正村　幸乃湯温泉,https://www.yukoyuko.net/5967,〒325-0115,栃木県那須塩原市百村３５３６−１幸乃湯温泉本館
リブマックスリゾート鬼怒川,https://www.yukoyuko.net/5970,〒321-2522,栃木県日光市鬼怒川温泉大原２
カンデオホテルズ佐野,https://www.yukoyuko.net/5979,〒327-0822,栃木県佐野市越名町２０３８−１カンデオホテルズ佐野
里の宿千春,https://www.yukoyuko.net/5981,〒321-2522,栃木県日光市鬼怒川温泉大原１３８８里の宿千春
鬼怒川温泉　山楽,https://www.yukoyuko.net/5983,〒321-2522,栃木県日光市鬼怒川温泉大原１０６０−３９９
〜滝見の宿〜　ゆとりろ那須塩原,https://www.yukoyuko.net/5986,〒329-2921,栃木県那須塩原市塩原１１１５−２
塩原温泉　桝田屋源泉の宿　ますだや,https://www.yukoyuko.net/5994,〒329-2921,栃木県那須塩原市塩原７２９
ホテル春茂登,https://www.yukoyuko.net/5996,〒321-1432,栃木県日光市安川町５−１３
湯元　板屋,https://www.yukoyuko.net/5998,〒321-1662,栃木県日光市湯元２５３０
亀の井ホテル 熱海 別館,https://www.yukoyuko.net/6006,〒413-0016,静岡県熱海市水口町２−１３−７７亀の井ホテル 熱海 別館
亀の井ホテル 熱海,https://www.yukoyuko.net/6007,〒413-0016,静岡県熱海市水口町2-12-3亀の井ホテル 熱海
くつろぎの宿　華,https://www.yukoyuko.net/6013,〒413-0232,静岡県伊東市八幡野１２４８−１
味湯海亭　福松荘,https://www.yukoyuko.net/6017,〒413-0303,静岡県賀茂郡東伊豆町片瀬５３−１
カンデオホテルズ静岡島田,https://www.yukoyuko.net/6027,〒427-0104,静岡県島田市井口１４１７
小さなホテル　檸檬樹,https://www.yukoyuko.net/6031,〒413-0234,静岡県伊東市池６３２−１０５
伊豆高原　介山・本館　伊豆梛,https://www.yukoyuko.net/6032,〒413-0231,静岡県伊東市富戸１０９５−２２５
伊豆の宿　昭和館,https://www.yukoyuko.net/6035,〒410-3302,静岡県伊豆市土肥３０６
御宿　風月無辺,https://www.yukoyuko.net/6036,〒413-0301,静岡県加茂郡東伊豆町大川１０９６−１
伊東遊季亭,https://www.yukoyuko.net/6039,〒414-0012,静岡県伊東市宝町１−８
伊豆今井浜東急ホテル,https://www.yukoyuko.net/6040,〒413-0503,静岡県賀茂郡河津町見高今井３５−１
愛犬お宿　伊豆高原,https://www.yukoyuko.net/6043,〒413-0231,静岡県伊東市富戸１０３８−９１
恋人岬オーシャンビューリゾート岬　ｍｉｓａｋｉ,https://www.yukoyuko.net/6045,〒410-3304,静岡県伊豆市小下田３１３５−１
ホテル山田屋,https://www.yukoyuko.net/6049,〒415-0013,静岡県下田市柿崎４０−６１
国民宿舎　奥浜名湖,https://www.yukoyuko.net/6054,〒431-1305,静岡県浜松市浜名区細江町気賀１０２３−１
くれたけイン御殿場インター,https://www.yukoyuko.net/6057,〒412-0026,静岡県御殿場市東田中１２４３−６
くれたけイン御前崎,https://www.yukoyuko.net/6058,〒437-1612,静岡県御前崎市池新田７６４４
伊豆の宿　清流荘,https://www.yukoyuko.net/6059,〒415-0011,静岡県下田市河内２−２
ウブドの森,https://www.yukoyuko.net/6065,〒413-0231,静岡県伊東市富戸１００７−２１
伊東　緑涌,https://www.yukoyuko.net/6071,〒414-0038,静岡県伊東市広野２−２−５
海を臨む全室半露天付　離れ御宿　夢のや,https://www.yukoyuko.net/6074,〒413-0231,静岡県伊東市富戸９２７−９
アンダの森 伊豆いっぺき湖,https://www.yukoyuko.net/6075,〒414-0051,静岡県伊東市吉田８３６−２アンダの森 伊豆いっぺき湖
季一遊,https://www.yukoyuko.net/6076,〒415-0152,静岡県賀茂郡南伊豆町湊９０２‐１
リブマックスリゾート天城湯ヶ島,https://www.yukoyuko.net/6077,〒410-3206,静岡県伊豆市湯ヶ島２８２１−４
リブマックスリゾート伊豆下田,https://www.yukoyuko.net/6078,〒415-0029,静岡県下田市田牛７１１−３
恋人岬プライベートリゾート　マリンメイツ,https://www.yukoyuko.net/6082,〒410-3304,静岡県伊豆市小下田３１５０−４
ゆとりろ熱海,https://www.yukoyuko.net/6084,〒413-0002,静岡県熱海市伊豆山１１７３−５３４ゆとりろ熱海
玉峰館,https://www.yukoyuko.net/6086,〒413-0511,静岡県賀茂郡河津町峰４４０
リブマックスリゾート伊東川奈,https://www.yukoyuko.net/6091,〒413-0231,静岡県伊東市富戸三野原１３０１
公共の宿　伊豆まつざき荘,https://www.yukoyuko.net/6093,〒410-3624,静岡県賀茂郡松崎町江奈２１０−１
熱川プリンスホテル,https://www.yukoyuko.net/6094,〒413-0302,静岡県賀茂郡東伊豆町奈良本１２４８−３熱川プリンスホテル
海ごはん・山ごはん「伊豆会席」かね吉一燈庵,https://www.yukoyuko.net/6095,〒413-0503,静岡県賀茂郡河津町見高１２３−５
心湯の宿〜ＳＡＺＡＮＡ〜,https://www.yukoyuko.net/6097,〒413-0411,静岡県賀茂郡東伊豆町稲取１５９４−１
リブマックスリゾート城ヶ崎海岸,https://www.yukoyuko.net/6099,〒413-0232,静岡県伊東市八幡野１７３６−５
森の温泉ホテル　はまゆう山荘,https://www.yukoyuko.net/6100,〒370-3405,群馬県高崎市倉渕町川浦２７−８０
千明仁泉亭,https://www.yukoyuko.net/6111,〒377-0102,群馬県渋川市　伊香保町伊香保４５
フォレストリゾート　コニファーいわびつ,https://www.yukoyuko.net/6112,〒377-0801,群馬県吾妻郡東吾妻原町４３９９
ホテル松本楼,https://www.yukoyuko.net/6114,〒377-0102,群馬県渋川市伊香保町伊香保１６４
草津温泉３２６　山の湯,https://www.yukoyuko.net/6119,〒377-1711,群馬県吾妻郡草津町草津３２６
鍾寿館,https://www.yukoyuko.net/6123,〒377-0601,群馬県吾妻郡中之条町四万３８９５
紀州鉄道軽井沢ホテル,https://www.yukoyuko.net/6124,〒377-1404,群馬県吾妻郡嬬恋村鎌原１５１４
草津グリーンパークパレス,https://www.yukoyuko.net/6128,〒377-1711,群馬県吾妻郡草津町草津白根４６４−５２３
奥嬬恋温泉　ふる里の宿　花いち,https://www.yukoyuko.net/6134,〒377-1611,群馬県吾妻郡嬬恋村大字干俣３８６
谷川温泉　檜の宿　水上山荘,https://www.yukoyuko.net/6135,〒379-1619,群馬県利根郡みなかみ町谷川５５６谷川温泉　檜の宿　水上山荘
万座温泉日進舘,https://www.yukoyuko.net/6136,〒377-1528,群馬県吾妻郡嬬恋村干俣万座温泉２４０１２４０１
錦綉山荘,https://www.yukoyuko.net/6137,〒378-0102,群馬県利根郡川場村大字川場湯原２０１１錦綉山荘
草津温泉　ホテルニュー紅葉,https://www.yukoyuko.net/6138,〒377-1711,群馬県吾妻郡草津町草津４６４−３４
源泉湯の宿　紫翠亭,https://www.yukoyuko.net/6140,〒378-0322,群馬県沼田市利根町老神５５０
伊東園ホテル尾瀬老神山楽荘,https://www.yukoyuko.net/6141,〒378-0322,群馬県沼田市利根町老神５８３伊東園ホテル尾瀬老神山楽荘
伊東園ホテル四万,https://www.yukoyuko.net/6142,〒377-0601,群馬県吾妻郡中之条町四万４３５８−１
伊香保温泉ホテル金太夫【伊東園ホテルズ】,https://www.yukoyuko.net/6143,〒377-0102,群馬県渋川市伊香保町伊香保１９
伊香保グランドホテル【伊東園ホテルズ】,https://www.yukoyuko.net/6144,〒377-0102,群馬県渋川市伊香保町伊香保５５０伊香保グランドホテル
ホテル湯の陣【伊東園ホテルズ】,https://www.yukoyuko.net/6145,〒379-1728,群馬県利根郡みなかみ町湯檜曽２０８
伊東園ホテル　草津,https://www.yukoyuko.net/6147,〒377-1711,群馬県吾妻郡草津町草津４６４−１０５１
お宿　ゆきずみ,https://www.yukoyuko.net/6150,〒377-1711,群馬県吾妻郡草津町草津39-12
湯宿　いわふじ,https://www.yukoyuko.net/6154,〒377-1711,群馬県吾妻郡草津町大字草津249-44
風木立の川辺　紫明館,https://www.yukoyuko.net/6156,〒379-1728,群馬県利根郡みなかみ町湯桧曽15-1
白沢高原ホテル,https://www.yukoyuko.net/6157,〒378-0126,群馬県沼田市白沢町上古語父2440
大江戸温泉物語 伊香保,https://www.yukoyuko.net/6160,〒377-0102,群馬県渋川市伊香保町伊香保592-1
草津温泉　日新館,https://www.yukoyuko.net/6164,〒377-1711,群馬県吾妻郡草津町草津368
パルコール嬬恋リゾートホテル,https://www.yukoyuko.net/6170,〒377-1611,群馬県吾妻郡嬬恋村干俣バラギ高原
老神温泉　もうひとつのふる里　山口屋,https://www.yukoyuko.net/6171,〒378-0322,群馬県沼田市利根町老神585
ペンション　朝ねぼう,https://www.yukoyuko.net/6172,〒379-1725,群馬県利根郡みなかみ町綱子294-1
湯畑の宿　佳乃や,https://www.yukoyuko.net/6173,〒377-1711,群馬県吾妻郡草津町草津95
上田屋旅館,https://www.yukoyuko.net/6178,〒378-0322,群馬県沼田市利根町老神596
旅籠屋　丸一,https://www.yukoyuko.net/6181,〒379-1403,群馬県利根郡みなかみ町猿ヶ京温泉199
草津温泉 ペンション五郎次,https://www.yukoyuko.net/6183,〒377-1711,群馬県吾妻郡草津町草津322‐1
草津温泉　ペンションみとも,https://www.yukoyuko.net/6185,〒377-1711,群馬県吾妻郡草津町草津235-114
草津温泉 ペンション ベルクラント,https://www.yukoyuko.net/6188,〒377-1711,群馬県吾妻郡草津町草津４６４−１０７５
伊香保温泉　お宿玉樹,https://www.yukoyuko.net/6189,〒377-0102,群馬県渋川市伊香保町伊香保87-2
リブマックスリゾート草津温泉,https://www.yukoyuko.net/6191,〒377171,群馬県吾妻郡草津町大字草津548-1
